,Show,Location,City,State,Date,Corps,GE1_Rep,GE1_Perf,GE1_Tot,GE2_Rep,GE2_Perf,GE2_Tot,GE1.2_TOTAL,GE3_Rep,GE3_Perf,GE3_Tot,GE4_Rep,GE4_Perf,GE4_Tot,GE3.4_TOTAL,Ge_TOTAL,VisP_Cont,VisP_Achv,VisP_Tot,VisA_Comp,VisA_Achv,VisA_Tot,CG_Sbst,CG_Achv,CG_Tot,Vis_TOTAL,MusB_Cont,MusB_Achv,MusB_Tot,MusA1_Cont,MusA1_Achv,MusA1_Tot,MusA2_Cont,MusA2_Achv,MusA2_Tot,MusA_TOTAL,MusP_Cont,MusP_Achv,MusP_Tot,Mus_TOTAL,Sub_TOTAL,Penalties,TOTAL,Place,year,month,day,Start,Season_Day
1,DCI Tour Premiere,"Indianapolis, IN",Indianapolis,IN,6/17/2015,The Cadets,75,70,14.5,72,70,14.2,NA,NA,NA,NA,NA,NA,NA,NA,28.7,69,66,13.5,71,68,13.9,70,66,13.6,20.5,70,67,13.7,74,72,14.6,NA,NA,NA,NA,66,64,13,20.65,69.85,0,69.85,1,2015,6,17,6/17/2015,0
2,DCI Tour Premiere,"Indianapolis, IN",Indianapolis,IN,6/17/2015,Bluecoats,67,64,13.1,73,71,14.4,NA,NA,NA,NA,NA,NA,NA,NA,27.5,68,65,13.3,73,69,14.2,71,67,13.8,20.65,69,69,13.8,71,69,14,NA,NA,NA,NA,62,62,12.4,20.1,68.25,0,68.25,2,2015,6,17,6/17/2015,0
3,DCI Tour Premiere,"Indianapolis, IN",Indianapolis,IN,6/17/2015,Carolina Crown,68,65,13.3,71,69,14,NA,NA,NA,NA,NA,NA,NA,NA,27.3,71,67,13.8,69,67,13.6,73,68,14.1,20.75,71,68,13.9,72,70,14.2,NA,NA,NA,NA,60,60,12,20.05,68.1,0,68.1,3,2015,6,17,6/17/2015,0
4,DCI Tour Premiere,"Indianapolis, IN",Indianapolis,IN,6/17/2015,The Cavaliers,65,61,12.6,67,63,13,NA,NA,NA,NA,NA,NA,NA,NA,25.6,67,63,13,62,61,12.3,58,54,11.2,18.25,68,60,12.8,69,67,13.6,NA,NA,NA,NA,63,58,12.1,19.25,63.1,0,63.1,4,2015,6,17,6/17/2015,0
5,DCI Tour Premiere,"Indianapolis, IN",Indianapolis,IN,6/17/2015,Madison Scouts,61,58,11.9,62,59,12.1,NA,NA,NA,NA,NA,NA,NA,NA,24,62,58,12,65,63,12.8,63,58,12.1,18.45,63,61,12.4,68,66,13.4,NA,NA,NA,NA,62,61,12.3,19.05,61.5,0,61.5,5,2015,6,17,6/17/2015,0
6,DCI Tour Premiere,"Indianapolis, IN",Indianapolis,IN,6/17/2015,Blue Stars,59,55,11.4,63,60,12.3,NA,NA,NA,NA,NA,NA,NA,NA,23.7,64,61,12.5,64,62,12.6,60,56,11.6,18.35,65,62,12.7,65,64,12.9,NA,NA,NA,NA,64,58,12.2,18.9,60.95,0,60.95,6,2015,6,17,6/17/2015,0
7,MidCal Champions Showcase,"Clovis, CA",Clovis,CA,6/19/2015,Blue Devils,70,73,14.3,74,71,14.5,NA,NA,NA,NA,NA,NA,NA,NA,28.8,71,70,14.1,76,73,14.9,75,71,14.6,21.8,72,69,14.1,79,73,15.2,NA,NA,NA,NA,70,69,13.9,21.6,72.2,0,72.2,1,2015,6,19,6/19/2015,0
8,MidCal Champions Showcase,"Clovis, CA",Clovis,CA,6/19/2015,Santa Clara Vanguard,69,71,14,73,68,14.1,NA,NA,NA,NA,NA,NA,NA,NA,28.1,69,68,13.7,73,71,14.4,74,70,14.4,21.25,70,67,13.7,77,70,14.7,NA,NA,NA,NA,71,70,14.1,21.25,70.6,0,70.6,2,2015,6,19,6/19/2015,0
9,MidCal Champions Showcase,"Clovis, CA",Clovis,CA,6/19/2015,Phantom Regiment,66,65,13.1,68,62,13,NA,NA,NA,NA,NA,NA,NA,NA,26.1,68,64,13.2,71,66,13.7,71,67,13.8,20.35,68,65,13.3,75,68,14.3,NA,NA,NA,NA,68,66,13.4,20.5,66.95,0,66.95,3,2015,6,19,6/19/2015,0
10,MidCal Champions Showcase,"Clovis, CA",Clovis,CA,6/19/2015,Blue Knights,68,62,13,65,63,12.8,NA,NA,NA,NA,NA,NA,NA,NA,25.8,65,61,12.6,69,64,13.3,66,63,12.9,19.4,65,62,12.7,74,66,14,NA,NA,NA,NA,69,68,13.7,20.2,65.4,0,65.4,4,2015,6,19,6/19/2015,0
11,MidCal Champions Showcase,"Clovis, CA",Clovis,CA,6/19/2015,Pacific Crest,60,57,11.7,59,54,11.3,NA,NA,NA,NA,NA,NA,NA,NA,23,63,55,11.8,62,58,12,57,53,11,17.4,62,56,11.8,67,56,12.3,NA,NA,NA,NA,59,56,11.5,17.8,58.2,0,58.2,5,2015,6,19,6/19/2015,0
12,MidCal Champions Showcase,"Clovis, CA",Clovis,CA,6/19/2015,Mandarins,56,58,11.4,56,52,10.8,NA,NA,NA,NA,NA,NA,NA,NA,22.2,59,51,11,58,52,11,47,44,9.1,15.55,59,54,11.3,69,58,12.7,NA,NA,NA,NA,61,59,12,18,55.75,0,55.75,6,2015,6,19,6/19/2015,0
13,DCI Louisville,"Louisville, KY",Louisville,KY,6/19/2015,The Cadets,73,71,14.4,74,70,14.4,NA,NA,NA,NA,NA,NA,NA,NA,28.8,NA,NA,NA,68,65,13.3,NA,NA,NA,13.3,72,69,14.1,75,72,14.7,NA,NA,NA,NA,NA,NA,NA,28.8,70.9,0,70.9,1,2015,6,19,6/17/2015,2
14,DCI Louisville,"Louisville, KY",Louisville,KY,6/19/2015,The Cavaliers,71,68,13.9,64,60,12.4,NA,NA,NA,NA,NA,NA,NA,NA,26.3,NA,NA,NA,61,59,12,NA,NA,NA,12,70,67,13.7,70,68,13.8,NA,NA,NA,NA,NA,NA,NA,27.5,65.8,0,65.8,2,2015,6,19,6/17/2015,2
15,DCI Louisville,"Louisville, KY",Louisville,KY,6/19/2015,Madison Scouts,66,64,13,61,56,11.7,NA,NA,NA,NA,NA,NA,NA,NA,24.7,NA,NA,NA,62,60,12.2,NA,NA,NA,12.2,60,61,12.1,68,66,13.4,NA,NA,NA,NA,NA,NA,NA,25.5,62.4,0,62.4,3,2015,6,19,6/17/2015,2
16,DCI Louisville,"Louisville, KY",Louisville,KY,6/19/2015,Blue Stars,65,63,12.8,59,54,11.3,NA,NA,NA,NA,NA,NA,NA,NA,24.1,NA,NA,NA,58,56,11.4,NA,NA,NA,11.4,66,63,12.9,70,66,13.6,NA,NA,NA,NA,NA,NA,NA,26.5,62,0,62,4,2015,6,19,6/17/2015,2
17,DCI Louisville,"Louisville, KY",Louisville,KY,6/19/2015,Crossmen,61,59,12,62,58,12,NA,NA,NA,NA,NA,NA,NA,NA,24,NA,NA,NA,63,61,12.4,NA,NA,NA,12.4,61,64,12.5,64,59,12.3,NA,NA,NA,NA,NA,NA,NA,24.8,61.2,0,61.2,5,2015,6,19,6/19/2015,0
18,DCI Louisville,"Louisville, KY",Louisville,KY,6/19/2015,Troopers,63,60,12.3,53,49,10.2,NA,NA,NA,NA,NA,NA,NA,NA,22.5,NA,NA,NA,59,57,11.6,NA,NA,NA,11.6,63,60,12.3,61,56,11.7,NA,NA,NA,NA,NA,NA,NA,24,58.1,0,58.1,6,2015,6,19,6/19/2015,0
19,Legends Drum Corps Preview,"Plainwell, MI",Plainwell,MI,6/20/2015,Madison Scouts,64,61,12.5,67,64,13.1,NA,NA,NA,NA,NA,NA,NA,NA,25.6,NA,NA,NA,64,61,12.5,67,64,13.1,25.6,NA,NA,NA,64,65,12.9,NA,NA,NA,NA,NA,NA,NA,12.9,64.1,0,64.1,1,2015,6,20,6/17/2015,3
20,Legends Drum Corps Preview,"Plainwell, MI",Plainwell,MI,6/20/2015,Crossmen,62,58,12,61,59,12,NA,NA,NA,NA,NA,NA,NA,NA,24,NA,NA,NA,63,60,12.3,65,63,12.8,25.1,NA,NA,NA,62,69,13.1,NA,NA,NA,NA,NA,NA,NA,13.1,62.2,0,62.2,2,2015,6,20,6/19/2015,1
21,Legends Drum Corps Preview,"Plainwell, MI",Plainwell,MI,6/20/2015,Spirit of Atlanta,59,55,11.4,58,53,11.1,NA,NA,NA,NA,NA,NA,NA,NA,22.5,NA,NA,NA,59,56,11.5,61,55,11.6,23.1,NA,NA,NA,63,62,12.5,NA,NA,NA,NA,NA,NA,NA,12.5,58.1,0,58.1,3,2015,6,20,6/20/2015,0
22,Legends Drum Corps Preview,"Plainwell, MI",Plainwell,MI,6/20/2015,Colts,52,50,10.2,60,58,11.8,NA,NA,NA,NA,NA,NA,NA,NA,22,NA,NA,NA,57,54,11.1,60,59,11.9,23,NA,NA,NA,60,68,12.8,NA,NA,NA,NA,NA,NA,NA,12.8,57.8,0,57.8,4,2015,6,20,6/20/2015,0
23,Innovations in Brass: Akron,"Akron, OH",Akron,OH,6/20/2015,Bluecoats,76,71,14.7,76,73,14.9,NA,NA,NA,NA,NA,NA,NA,NA,29.6,74,72,14.6,71,69,14,75,72,14.7,21.65,80,68,14.8,77,69,14.6,NA,NA,NA,NA,73,73,14.6,22,73.25,0,73.25,1,2015,6,20,6/17/2015,3
24,Innovations in Brass: Akron,"Akron, OH",Akron,OH,6/20/2015,The Cadets,77,74,15.1,74,74,14.8,NA,NA,NA,NA,NA,NA,NA,NA,29.9,72,69,14.1,72,71,14.3,74,70,14.4,21.4,81,66,14.7,74,71,14.5,NA,NA,NA,NA,74,71,14.5,21.85,73.15,0,73.15,2,2015,6,20,6/17/2015,3
25,Innovations in Brass: Akron,"Akron, OH",Akron,OH,6/20/2015,Carolina Crown,73,72,14.5,70,72,14.2,NA,NA,NA,NA,NA,NA,NA,NA,28.7,73,70,14.3,65,65,13,78,73,15.1,21.2,78,71,14.9,73,70,14.3,NA,NA,NA,NA,71,70,14.1,21.65,71.55,0,71.55,3,2015,6,20,6/17/2015,3
26,Innovations in Brass: Akron,"Akron, OH",Akron,OH,6/20/2015,The Cavaliers,68,65,13.3,64,65,12.9,NA,NA,NA,NA,NA,NA,NA,NA,26.2,68,66,13.4,66,63,12.9,68,63,13.1,19.7,75,66,14.1,71,68,13.9,NA,NA,NA,NA,69,68,13.7,20.85,66.75,0,66.75,4,2015,6,20,6/17/2015,3
27,Innovations in Brass: Akron,"Akron, OH",Akron,OH,6/20/2015,Blue Stars,65,63,12.8,65,63,12.8,NA,NA,NA,NA,NA,NA,NA,NA,25.6,64,62,12.6,63,62,12.5,66,62,12.8,18.95,70,68,13.8,66,64,13,NA,NA,NA,NA,68,66,13.4,20.1,64.65,0,64.65,5,2015,6,20,6/17/2015,3
28,Innovations in Brass: Akron,"Akron, OH",Akron,OH,6/20/2015,Boston Crusaders,61,57,11.8,61,55,11.6,NA,NA,NA,NA,NA,NA,NA,NA,23.4,66,63,12.9,61,57,11.8,63,58,12.1,18.4,66,64,13,63,59,12.2,NA,NA,NA,NA,64,60,12.4,18.8,60.6,0,60.6,6,2015,6,20,6/20/2015,0
29,Innovations in Brass: Akron,"Akron, OH",Akron,OH,6/20/2015,Troopers,63,61,12.4,58,54,11.2,NA,NA,NA,NA,NA,NA,NA,NA,23.6,59,55,11.4,58,56,11.4,60,56,11.6,17.2,63,60,12.3,64,60,12.4,NA,NA,NA,NA,63,62,12.5,18.6,59.4,0,59.4,7,2015,6,20,6/19/2015,1
30,DCI West,"Stanford, CA",Stanford,CA,6/20/2015,Blue Devils,77,75,15.2,73,72,14.5,NA,NA,NA,NA,NA,NA,NA,NA,29.7,73,71,14.4,76,74,15,71,67,13.8,21.6,75,71,14.6,76,75,15.1,NA,NA,NA,NA,74,72,14.6,22.15,73.45,0,73.45,1,2015,6,20,6/19/2015,1
31,DCI West,"Stanford, CA",Stanford,CA,6/20/2015,Santa Clara Vanguard,75,73,14.8,72,70,14.2,NA,NA,NA,NA,NA,NA,NA,NA,29,72,68,14,73,70,14.3,72,68,14,21.15,72,68,14,73,72,14.5,NA,NA,NA,NA,76,74,15,21.75,71.9,0,71.9,2,2015,6,20,6/19/2015,1
32,DCI West,"Stanford, CA",Stanford,CA,6/20/2015,Phantom Regiment,72,70,14.2,66,63,12.9,NA,NA,NA,NA,NA,NA,NA,NA,27.1,69,64,13.3,71,68,13.9,68,64,13.2,20.2,68,66,13.4,70,69,13.9,NA,NA,NA,NA,72,70,14.2,20.75,68.05,0,68.05,3,2015,6,20,6/19/2015,1
33,DCI West,"Stanford, CA",Stanford,CA,6/20/2015,Blue Knights,69,67,13.6,67,64,13.1,NA,NA,NA,NA,NA,NA,NA,NA,26.7,66,60,12.6,69,65,13.4,65,62,12.7,19.35,66,64,13,71,67,13.8,NA,NA,NA,NA,70,69,13.9,20.35,66.4,0,66.4,4,2015,6,20,6/19/2015,1
34,DCI West,"Stanford, CA",Stanford,CA,6/20/2015,Pacific Crest,68,64,13.2,61,59,12,NA,NA,NA,NA,NA,NA,NA,NA,25.2,62,56,11.8,65,62,12.7,58,56,11.4,17.95,61,57,11.8,63,54,11.7,NA,NA,NA,NA,63,59,12.2,17.85,61,0,61,5,2015,6,20,6/19/2015,1
35,DCI West,"Stanford, CA",Stanford,CA,6/20/2015,Mandarins,65,62,12.7,63,58,12.1,NA,NA,NA,NA,NA,NA,NA,NA,24.8,57,57,11.4,63,61,12.4,57,54,11.1,17.45,59,53,11.2,62,57,11.9,NA,NA,NA,NA,61,60,12.1,17.6,59.85,0,59.85,6,2015,6,20,6/19/2015,1
36,Moonlight Classic,"Sacramento, CA",Sacramento,CA,6/21/2015,Blue Devils,76,74,15,77,75,15.2,NA,NA,NA,NA,NA,NA,NA,NA,30.2,77,74,15.1,76,74,15,75,73,14.8,22.45,78,76,15.4,76,74,15,NA,NA,NA,NA,74,72,14.6,22.5,75.15,0,75.15,1,2015,6,21,6/19/2015,2
37,Moonlight Classic,"Sacramento, CA",Sacramento,CA,6/21/2015,Santa Clara Vanguard,74,72,14.6,74,73,14.7,NA,NA,NA,NA,NA,NA,NA,NA,29.3,75,70,14.5,74,73,14.7,74,71,14.5,21.85,75,73,14.8,75,72,14.7,NA,NA,NA,NA,75,74,14.9,22.2,73.35,0,73.35,2,2015,6,21,6/19/2015,2
38,Moonlight Classic,"Sacramento, CA",Sacramento,CA,6/21/2015,Phantom Regiment,73,70,14.3,68,65,13.3,NA,NA,NA,NA,NA,NA,NA,NA,27.6,70,65,13.5,69,64,13.3,69,66,13.5,20.15,65,63,12.8,73,71,14.4,NA,NA,NA,NA,70,69,13.9,20.55,68.3,0,68.3,3,2015,6,21,6/19/2015,2
39,Moonlight Classic,"Sacramento, CA",Sacramento,CA,6/21/2015,Blue Knights,71,71,14.2,66,64,13,NA,NA,NA,NA,NA,NA,NA,NA,27.2,68,62,13,66,62,12.8,65,64,12.9,19.35,66,64,13,71,69,14,NA,NA,NA,NA,71,65,13.6,20.3,66.85,0,66.85,4,2015,6,21,6/19/2015,2
40,Moonlight Classic,"Sacramento, CA",Sacramento,CA,6/21/2015,Pacific Crest,62,61,12.3,63,60,12.3,NA,NA,NA,NA,NA,NA,NA,NA,24.6,57,53,11,56,54,11,58,53,11.1,16.55,61,58,11.9,65,61,12.6,NA,NA,NA,NA,63,60,12.3,18.4,59.55,0,59.55,5,2015,6,21,6/19/2015,2
41,Moonlight Classic,"Sacramento, CA",Sacramento,CA,6/21/2015,Mandarins,63,62,12.5,62,59,12.1,NA,NA,NA,NA,NA,NA,NA,NA,24.6,58,51,10.9,54,53,10.7,51,44,9.5,15.55,60,56,11.6,63,60,12.3,NA,NA,NA,NA,61,61,12.2,18.05,58.2,0,58.2,6,2015,6,21,6/19/2015,2
42,Cavalcade of Brass,"Lisle, IL",Lisle,IL,6/21/2015,The Cadets,77,74,15.1,78,74,15.2,NA,NA,NA,NA,NA,NA,NA,NA,30.3,NA,NA,NA,72,69,14.1,NA,NA,NA,14.1,NA,NA,NA,79,71,15,NA,NA,NA,NA,77,75,15.2,30.2,74.6,0,74.6,1,2015,6,21,6/17/2015,4
43,Cavalcade of Brass,"Lisle, IL",Lisle,IL,6/21/2015,Bluecoats,76,73,14.9,76,75,15.1,NA,NA,NA,NA,NA,NA,NA,NA,30,NA,NA,NA,73,70,14.3,NA,NA,NA,14.3,NA,NA,NA,77,72,14.9,NA,NA,NA,NA,75,70,14.5,29.4,73.7,0,73.7,2,2015,6,21,6/17/2015,4
44,Cavalcade of Brass,"Lisle, IL",Lisle,IL,6/21/2015,Carolina Crown,74,72,14.6,75,73,14.8,NA,NA,NA,NA,NA,NA,NA,NA,29.4,NA,NA,NA,69,66,13.5,NA,NA,NA,13.5,NA,NA,NA,76,75,15.1,NA,NA,NA,NA,74,74,14.8,29.9,72.8,0,72.8,3,2015,6,21,6/17/2015,4
45,Cavalcade of Brass,"Lisle, IL",Lisle,IL,6/21/2015,The Cavaliers,69,65,13.4,71,70,14.1,NA,NA,NA,NA,NA,NA,NA,NA,27.5,NA,NA,NA,67,63,13,NA,NA,NA,13,NA,NA,NA,74,69,14.3,NA,NA,NA,NA,72,71,14.3,28.6,69.1,0,69.1,4,2015,6,21,6/17/2015,4
46,Cavalcade of Brass,"Lisle, IL",Lisle,IL,6/21/2015,Crossmen,63,59,12.2,67,68,13.5,NA,NA,NA,NA,NA,NA,NA,NA,25.7,NA,NA,NA,66,62,12.8,NA,NA,NA,12.8,NA,NA,NA,66,64,13,NA,NA,NA,NA,61,58,11.9,24.9,63.4,0,63.4,5,2015,6,21,6/19/2015,2
47,Cavalcade of Brass,"Lisle, IL",Lisle,IL,6/21/2015,Boston Crusaders,65,61,12.6,64,65,12.9,NA,NA,NA,NA,NA,NA,NA,NA,25.5,NA,NA,NA,63,59,12.2,NA,NA,NA,12.2,NA,NA,NA,68,65,13.3,NA,NA,NA,NA,64,59,12.3,25.6,63.3,0,63.3,6,2015,6,21,6/20/2015,1
48,Cavalcade of Brass,"Lisle, IL",Lisle,IL,6/21/2015,Colts,54,51,10.5,55,55,11,NA,NA,NA,NA,NA,NA,NA,NA,21.5,NA,NA,NA,58,57,11.5,NA,NA,NA,11.5,NA,NA,NA,62,63,12.5,NA,NA,NA,NA,59,57,11.6,24.1,57.1,0,57.1,7,2015,6,21,6/20/2015,1
49,Pacific Proscession,"Santa Clara, CA",Santa Clara,CA,6/22/2015,Santa Clara Vanguard,77,76,15.3,75,73,14.8,NA,NA,NA,NA,NA,NA,NA,NA,30.1,NA,NA,NA,75,73,14.8,NA,NA,NA,14.8,76,74,15,76,74,15,NA,NA,NA,NA,NA,NA,NA,30,74.9,0,74.9,1,2015,6,22,6/19/2015,3
50,Pacific Proscession,"Santa Clara, CA",Santa Clara,CA,6/22/2015,Blue Knights,70,71,14.1,72,68,14,NA,NA,NA,NA,NA,NA,NA,NA,28.1,NA,NA,NA,70,69,13.9,NA,NA,NA,13.9,72,70,14.2,72,70,14.2,NA,NA,NA,NA,NA,NA,NA,28.4,70.4,0,70.4,2,2015,6,22,6/19/2015,3
51,Pacific Proscession,"Santa Clara, CA",Santa Clara,CA,6/22/2015,Phantom Regiment,73,70,14.3,71,71,14.2,NA,NA,NA,NA,NA,NA,NA,NA,28.5,NA,NA,NA,72,68,14,NA,NA,NA,14,68,66,13.4,73,71,14.4,NA,NA,NA,NA,NA,NA,NA,27.8,70.3,0,70.3,3,2015,6,22,6/19/2015,3
52,Pacific Proscession,"Santa Clara, CA",Santa Clara,CA,6/22/2015,Pacific Crest,67,64,13.1,63,60,12.3,NA,NA,NA,NA,NA,NA,NA,NA,25.4,NA,NA,NA,67,65,13.2,NA,NA,NA,13.2,64,62,12.6,67,62,12.9,NA,NA,NA,NA,NA,NA,NA,25.5,64.1,0,64.1,4,2015,6,22,6/19/2015,3
53,Pacific Proscession,"Santa Clara, CA",Santa Clara,CA,6/22/2015,Mandarins,65,62,12.7,62,58,12,NA,NA,NA,NA,NA,NA,NA,NA,24.7,NA,NA,NA,60,58,11.8,NA,NA,NA,11.8,59,53,11.2,66,60,12.6,NA,NA,NA,NA,NA,NA,NA,23.8,60.3,0,60.3,5,2015,6,22,6/19/2015,3
54,Summer Music Games in Cincinnati,"Hamilton, OH",Hamilton,OH,6/22/2015,Bluecoats,75,71,14.6,78,75,15.3,NA,NA,NA,NA,NA,NA,NA,NA,29.9,NA,NA,NA,74,72,14.6,76,74,15,29.6,NA,NA,NA,73,71,14.4,NA,NA,NA,NA,NA,NA,NA,14.4,73.9,0,73.9,1,2015,6,22,6/17/2015,5
55,Summer Music Games in Cincinnati,"Hamilton, OH",Hamilton,OH,6/22/2015,Carolina Crown,71,70,14.1,76,74,15,NA,NA,NA,NA,NA,NA,NA,NA,29.1,NA,NA,NA,70,69,13.9,78,73,15.1,29,NA,NA,NA,74,73,14.7,NA,NA,NA,NA,NA,NA,NA,14.7,72.8,0,72.8,2,2015,6,22,6/17/2015,5
56,Summer Music Games in Cincinnati,"Hamilton, OH",Hamilton,OH,6/22/2015,Madison Scouts,68,66,13.4,69,68,13.7,NA,NA,NA,NA,NA,NA,NA,NA,27.1,NA,NA,NA,68,67,13.5,65,63,12.8,26.3,NA,NA,NA,69,66,13.5,NA,NA,NA,NA,NA,NA,NA,13.5,66.9,0,66.9,3,2015,6,22,6/17/2015,5
57,Summer Music Games in Cincinnati,"Hamilton, OH",Hamilton,OH,6/22/2015,Blue Stars,66,64,13,71,69,14,NA,NA,NA,NA,NA,NA,NA,NA,27,NA,NA,NA,65,63,12.8,66,61,12.7,25.5,NA,NA,NA,68,65,13.3,NA,NA,NA,NA,NA,NA,NA,13.3,65.8,0,65.8,4,2015,6,22,6/17/2015,5
58,Summer Music Games in Cincinnati,"Hamilton, OH",Hamilton,OH,6/22/2015,Troopers,62,59,12.1,62,56,11.8,NA,NA,NA,NA,NA,NA,NA,NA,23.9,NA,NA,NA,64,62,12.6,62,59,12.1,24.7,NA,NA,NA,65,67,13.2,NA,NA,NA,NA,NA,NA,NA,13.2,61.8,0,61.8,5,2015,6,22,6/19/2015,3
59,Summer Music Games in Cincinnati,"Hamilton, OH",Hamilton,OH,6/22/2015,Boston Crusaders,61,57,11.8,67,62,12.9,NA,NA,NA,NA,NA,NA,NA,NA,24.7,NA,NA,NA,63,61,12.4,63,60,12.3,24.7,NA,NA,NA,61,62,12.3,NA,NA,NA,NA,NA,NA,NA,12.3,61.7,0,61.7,6,2015,6,22,6/20/2015,2
60,Summer Music Games in Cincinnati,"Hamilton, OH",Hamilton,OH,6/22/2015,Spirit of Atlanta,60,54,11.4,56,51,10.7,NA,NA,NA,NA,NA,NA,NA,NA,22.1,NA,NA,NA,62,60,12.2,58,53,11.1,23.3,NA,NA,NA,59,59,11.8,NA,NA,NA,NA,NA,NA,NA,11.8,57.2,0,57.2,7,2015,6,22,6/20/2015,2
61,DCI St. Louis,"O'Fallon, IL",O'Fallon,IL,6/23/2015,The Cadets,79,74,15.3,78,74,15.2,NA,NA,NA,NA,NA,NA,NA,NA,30.5,NA,NA,NA,77,74,15.1,NA,NA,NA,15.1,76,74,15,80,75,15.5,NA,NA,NA,NA,NA,NA,NA,30.5,76.1,0,76.1,1,2015,6,23,6/17/2015,6
62,DCI St. Louis,"O'Fallon, IL",O'Fallon,IL,6/23/2015,The Cavaliers,71,68,13.9,73,71,14.4,NA,NA,NA,NA,NA,NA,NA,NA,28.3,NA,NA,NA,72,70,14.2,NA,NA,NA,14.2,72,69,14.1,76,72,14.8,NA,NA,NA,NA,NA,NA,NA,28.9,71.4,0,71.4,2,2015,6,23,6/17/2015,6
63,DCI St. Louis,"O'Fallon, IL",O'Fallon,IL,6/23/2015,Crossmen,57,56,11.3,69,67,13.6,NA,NA,NA,NA,NA,NA,NA,NA,24.9,NA,NA,NA,70,68,13.8,NA,NA,NA,13.8,69,66,13.5,68,64,13.2,NA,NA,NA,NA,NA,NA,NA,26.7,65.4,0,65.4,3,2015,6,23,6/19/2015,4
64,DCI St. Louis,"O'Fallon, IL",O'Fallon,IL,6/23/2015,Spirit of Atlanta,59,57,11.6,65,62,12.7,NA,NA,NA,NA,NA,NA,NA,NA,24.3,NA,NA,NA,66,62,12.8,NA,NA,NA,12.8,64,62,12.6,66,61,12.7,NA,NA,NA,NA,NA,NA,NA,25.3,62.4,0,62.4,4,2015,6,23,6/20/2015,3
65,DCI St. Louis,"O'Fallon, IL",O'Fallon,IL,6/23/2015,Colts,60,54,11.4,62,59,12.1,NA,NA,NA,NA,NA,NA,NA,NA,23.5,NA,NA,NA,63,60,12.3,NA,NA,NA,12.3,67,63,13,63,58,12.1,NA,NA,NA,NA,NA,NA,NA,25.1,60.9,0,60.9,5,2015,6,23,6/20/2015,3
66,DCI St. Louis,"O'Fallon, IL",O'Fallon,IL,6/23/2015,Pioneer,54,51,10.5,56,51,10.7,NA,NA,NA,NA,NA,NA,NA,NA,21.2,NA,NA,NA,57,53,11,NA,NA,NA,11,45,41,8.6,56,50,10.6,NA,NA,NA,NA,NA,NA,NA,19.2,51.4,0,51.4,6,2015,6,23,6/23/2015,0
67,Drums on the Ohio,"Evansville, IN",Evansville,IN,6/24/2015,The Cadets,80,76,15.6,79,74,15.3,NA,NA,NA,NA,NA,NA,NA,NA,30.9,NA,NA,NA,79,74,15.3,NA,NA,NA,15.3,NA,NA,NA,80,76,15.6,NA,NA,NA,NA,79,75,15.4,31,77.2,0,77.2,1,2015,6,24,6/17/2015,7
68,Drums on the Ohio,"Evansville, IN",Evansville,IN,6/24/2015,The Cavaliers,73,71,14.4,75,70,14.5,NA,NA,NA,NA,NA,NA,NA,NA,28.9,NA,NA,NA,73,70,14.3,NA,NA,NA,14.3,NA,NA,NA,78,73,15.1,NA,NA,NA,NA,75,71,14.6,29.7,72.9,0,72.9,2,2015,6,24,6/17/2015,7
69,Drums on the Ohio,"Evansville, IN",Evansville,IN,6/24/2015,Crossmen,69,66,13.5,68,65,13.3,NA,NA,NA,NA,NA,NA,NA,NA,26.8,NA,NA,NA,70,69,13.9,NA,NA,NA,13.9,NA,NA,NA,71,67,13.8,NA,NA,NA,NA,65,61,12.6,26.4,67.1,0,67.1,3,2015,6,24,6/19/2015,5
70,Drums on the Ohio,"Evansville, IN",Evansville,IN,6/24/2015,Spirit of Atlanta,65,61,12.6,67,63,13,NA,NA,NA,NA,NA,NA,NA,NA,25.6,NA,NA,NA,67,64,13.1,NA,NA,NA,13.1,NA,NA,NA,67,61,12.8,NA,NA,NA,NA,63,59,12.2,25,63.7,0,63.7,4,2015,6,24,6/20/2015,4
71,Drums on the Ohio,"Evansville, IN",Evansville,IN,6/24/2015,Colts,63,60,12.3,62,58,12,NA,NA,NA,NA,NA,NA,NA,NA,24.3,NA,NA,NA,62,61,12.3,NA,NA,NA,12.3,NA,NA,NA,60,59,11.9,NA,NA,NA,NA,61,62,12.3,24.2,60.8,0,60.8,5,2015,6,24,6/20/2015,4
72,Drums on the Ohio,"Evansville, IN",Evansville,IN,6/24/2015,Pioneer,55,51,10.6,55,50,10.5,NA,NA,NA,NA,NA,NA,NA,NA,21.1,NA,NA,NA,59,54,11.3,NA,NA,NA,11.3,NA,NA,NA,51,44,9.5,NA,NA,NA,NA,53,49,10.2,19.7,52.1,0,52.1,6,2015,6,24,6/23/2015,1
73,Innovations in Brass: Pittsburgh,"Pittsburgh, PA",Pittsburgh,PA,6/24/2015,Bluecoats,77,74,15.1,75,73,14.8,NA,NA,NA,NA,NA,NA,NA,NA,29.9,NA,NA,NA,76,72,14.8,77,75,15.2,30,NA,NA,NA,76,74,15,NA,NA,NA,NA,NA,NA,NA,15,74.9,0,74.9,1,2015,6,24,6/17/2015,7
74,Innovations in Brass: Pittsburgh,"Pittsburgh, PA",Pittsburgh,PA,6/24/2015,Blue Stars,72,65,13.7,70,67,13.7,NA,NA,NA,NA,NA,NA,NA,NA,27.4,NA,NA,NA,71,68,13.9,66,61,12.7,26.6,NA,NA,NA,70,69,13.9,NA,NA,NA,NA,NA,NA,NA,13.9,67.9,0,67.9,2,2015,6,24,6/17/2015,7
75,Innovations in Brass: Pittsburgh,"Pittsburgh, PA",Pittsburgh,PA,6/24/2015,Madison Scouts,69,66,13.5,66,65,13.1,NA,NA,NA,NA,NA,NA,NA,NA,26.6,NA,NA,NA,69,67,13.6,67,65,13.2,26.8,NA,NA,NA,69,68,13.7,NA,NA,NA,NA,NA,NA,NA,13.7,67.1,0,67.1,3,2015,6,24,6/17/2015,7
76,Innovations in Brass: Pittsburgh,"Pittsburgh, PA",Pittsburgh,PA,6/24/2015,Boston Crusaders,66,62,12.8,67,63,13,NA,NA,NA,NA,NA,NA,NA,NA,25.8,NA,NA,NA,64,61,12.5,68,63,13.1,25.6,NA,NA,NA,65,61,12.6,NA,NA,NA,NA,NA,NA,NA,12.6,64,0,64,4,2015,6,24,6/20/2015,4
77,Innovations in Brass: Pittsburgh,"Pittsburgh, PA",Pittsburgh,PA,6/24/2015,Troopers,67,64,13.1,63,60,12.3,NA,NA,NA,NA,NA,NA,NA,NA,25.4,NA,NA,NA,66,64,13,64,58,12.2,25.2,NA,NA,NA,66,65,13.1,NA,NA,NA,NA,NA,NA,NA,13.1,63.7,0,63.7,5,2015,6,24,6/19/2015,5
78,Corps at the Crest Los Angeles,"Pasadena, CA",Pasadena,CA,6/27/2015,Blue Devils,80,78,15.8,82,78,16,NA,NA,NA,NA,NA,NA,NA,NA,31.8,81,77,15.8,82,78,16,80,77,15.7,23.75,80,76,15.6,81,79,16,NA,NA,NA,NA,81,80,16.1,23.85,79.4,0,79.4,1,2015,6,27,6/19/2015,8
79,Corps at the Crest Los Angeles,"Pasadena, CA",Pasadena,CA,6/27/2015,Santa Clara Vanguard,78,76,15.4,80,76,15.6,NA,NA,NA,NA,NA,NA,NA,NA,31,79,76,15.5,80,77,15.7,78,76,15.4,23.3,77,73,15,79,76,15.5,NA,NA,NA,NA,80,79,15.9,23.2,77.5,0,77.5,2,2015,6,27,6/19/2015,8
80,Corps at the Crest Los Angeles,"Pasadena, CA",Pasadena,CA,6/27/2015,Phantom Regiment,73,70,14.3,77,72,14.9,NA,NA,NA,NA,NA,NA,NA,NA,29.2,77,73,15,76,71,14.7,73,71,14.4,22.05,75,68,14.3,75,73,14.8,NA,NA,NA,NA,74,73,14.7,21.9,73.15,0,73.15,3,2015,6,27,6/19/2015,8
81,Corps at the Crest Los Angeles,"Pasadena, CA",Pasadena,CA,6/27/2015,Blue Knights,70,69,13.9,78,73,15.1,NA,NA,NA,NA,NA,NA,NA,NA,29,75,72,14.7,75,73,14.8,71,69,14,21.75,74,70,14.4,74,71,14.5,NA,NA,NA,NA,77,75,15.2,22.05,72.8,0,72.8,4,2015,6,27,6/19/2015,8
82,Corps at the Crest Los Angeles,"Pasadena, CA",Pasadena,CA,6/27/2015,The Academy,69,66,13.5,71,64,13.5,NA,NA,NA,NA,NA,NA,NA,NA,27,67,66,13.3,70,66,13.6,69,66,13.5,20.2,68,63,13.1,68,65,13.3,NA,NA,NA,NA,70,64,13.4,19.9,67.1,0,67.1,5,2015,6,27,6/27/2015,0
83,Corps at the Crest Los Angeles,"Pasadena, CA",Pasadena,CA,6/27/2015,Pacific Crest,66,64,13,70,66,13.6,NA,NA,NA,NA,NA,NA,NA,NA,26.6,65,64,12.9,68,63,13.1,67,65,13.2,19.6,65,61,12.6,65,63,12.8,NA,NA,NA,NA,68,65,13.3,19.35,65.55,0,65.55,6,2015,6,27,6/19/2015,8
84,Corps at the Crest Los Angeles,"Pasadena, CA",Pasadena,CA,6/27/2015,Mandarins,64,60,12.4,64,60,12.4,NA,NA,NA,NA,NA,NA,NA,NA,24.8,64,62,12.6,69,64,13.3,62,58,12,18.95,63,58,12.1,64,62,12.6,NA,NA,NA,NA,66,62,12.8,18.75,62.5,0,62.5,7,2015,6,27,6/19/2015,8
85,Western Corps Connection,"Riverside, CA",Riverside,CA,6/28/2015,Blue Devils,79,77,15.6,82,79,16.1,NA,NA,NA,NA,NA,NA,NA,NA,31.7,82,79,16.1,83,79,16.2,80,79,15.9,24.1,82,80,16.2,81,78,15.9,NA,NA,NA,NA,81,79,16,24.05,79.85,0,79.85,1,2015,6,28,6/19/2015,9
86,Western Corps Connection,"Riverside, CA",Riverside,CA,6/28/2015,Santa Clara Vanguard,77,76,15.3,81,78,15.9,NA,NA,NA,NA,NA,NA,NA,NA,31.2,80,79,15.9,81,78,15.9,79,77,15.6,23.7,80,76,15.6,80,77,15.7,NA,NA,NA,NA,82,80,16.2,23.75,78.65,0,78.65,2,2015,6,28,6/19/2015,9
87,Western Corps Connection,"Riverside, CA",Riverside,CA,6/28/2015,Phantom Regiment,71,69,14,76,74,15,NA,NA,NA,NA,NA,NA,NA,NA,29,75,71,14.6,75,72,14.7,73,73,14.6,21.95,76,70,14.6,75,73,14.8,NA,NA,NA,NA,74,71,14.5,21.95,72.9,0,72.9,3,2015,6,28,6/19/2015,9
88,Western Corps Connection,"Riverside, CA",Riverside,CA,6/28/2015,Blue Knights,70,68,13.8,77,75,15.2,NA,NA,NA,NA,NA,NA,NA,NA,29,72,70,14.2,74,71,14.5,71,70,14.1,21.4,74,71,14.5,74,72,14.6,NA,NA,NA,NA,76,73,14.9,22,72.4,0,72.4,4,2015,6,28,6/19/2015,9
89,Western Corps Connection,"Riverside, CA",Riverside,CA,6/28/2015,The Academy,65,64,12.9,67,63,13,NA,NA,NA,NA,NA,NA,NA,NA,25.9,70,67,13.7,70,66,13.6,67,63,13,20.15,68,65,13.3,67,65,13.2,NA,NA,NA,NA,68,65,13.3,19.9,65.95,0,65.95,5,2015,6,28,6/27/2015,1
90,Western Corps Connection,"Riverside, CA",Riverside,CA,6/28/2015,Pacific Crest,62,59,12.1,69,66,13.5,NA,NA,NA,NA,NA,NA,NA,NA,25.6,68,65,13.3,67,63,13,66,65,13.1,19.7,65,64,12.9,68,66,13.4,NA,NA,NA,NA,66,63,12.9,19.6,64.9,0,64.9,6,2015,6,28,6/19/2015,9
91,Western Corps Connection,"Riverside, CA",Riverside,CA,6/28/2015,Mandarins,63,60,12.3,65,63,12.8,NA,NA,NA,NA,NA,NA,NA,NA,25.1,65,60,12.5,68,64,13.2,63,59,12.2,18.95,64,61,12.5,66,64,13,NA,NA,NA,NA,64,61,12.5,19,63.05,0,63.05,7,2015,6,28,6/19/2015,9
92,River City Rhapsody - Rochester,"Rochester, MN",Rochester,MN,6/28/2015,Bluecoats,80,78,15.8,78,74,15.2,NA,NA,NA,NA,NA,NA,NA,NA,31,NA,NA,NA,80,77,15.7,NA,NA,NA,15.7,78,74,15.2,82,79,16.1,NA,NA,NA,NA,NA,NA,NA,31.3,78,0,78,1,2015,6,28,6/17/2015,11
93,River City Rhapsody - Rochester,"Rochester, MN",Rochester,MN,6/28/2015,Madison Scouts,74,71,14.5,69,68,13.7,NA,NA,NA,NA,NA,NA,NA,NA,28.2,NA,NA,NA,71,68,13.9,NA,NA,NA,13.9,71,66,13.7,72,70,14.2,NA,NA,NA,NA,NA,NA,NA,27.9,70,0,70,2,2015,6,28,6/17/2015,11
94,River City Rhapsody - Rochester,"Rochester, MN",Rochester,MN,6/28/2015,Blue Stars,72,69,14.1,68,67,13.5,NA,NA,NA,NA,NA,NA,NA,NA,27.6,NA,NA,NA,69,66,13.5,NA,NA,NA,13.5,70,65,13.5,71,69,14,NA,NA,NA,NA,NA,NA,NA,27.5,68.6,0,68.6,3,2015,6,28,6/17/2015,11
95,River City Rhapsody - Rochester,"Rochester, MN",Rochester,MN,6/28/2015,Colts,68,65,13.3,61,58,11.9,NA,NA,NA,NA,NA,NA,NA,NA,25.2,NA,NA,NA,67,63,13,NA,NA,NA,13,67,64,13.1,68,65,13.3,NA,NA,NA,NA,NA,NA,NA,26.4,64.6,0,64.6,4,2015,6,28,6/20/2015,8
96,River City Rhapsody - Rochester,"Rochester, MN",Rochester,MN,6/28/2015,Pioneer,54,52,10.6,60,56,11.6,NA,NA,NA,NA,NA,NA,NA,NA,22.2,NA,NA,NA,62,58,12,NA,NA,NA,12,53,48,10.1,55,53,10.8,NA,NA,NA,NA,NA,NA,NA,20.9,55.1,0,55.1,5,2015,6,28,6/23/2015,5
97,DCI All-Star Review,"Bowling Green, OH",Bowling Green,OH,6/28/2015,The Cadets,82,80,16.2,78,77,15.5,NA,NA,NA,NA,NA,NA,NA,NA,31.7,NA,NA,NA,76,74,15,NA,NA,NA,15,NA,NA,NA,81,79,16,NA,NA,NA,NA,83,80,16.3,32.3,79,0,79,1,2015,6,28,6/17/2015,11
98,DCI All-Star Review,"Bowling Green, OH",Bowling Green,OH,6/28/2015,Carolina Crown,81,78,15.9,76,75,15.1,NA,NA,NA,NA,NA,NA,NA,NA,31,NA,NA,NA,75,73,14.8,NA,NA,NA,14.8,NA,NA,NA,79,78,15.7,NA,NA,NA,NA,81,79,16,31.7,77.5,0,77.5,2,2015,6,28,6/17/2015,11
99,DCI All-Star Review,"Bowling Green, OH",Bowling Green,OH,6/28/2015,The Cavaliers,76,73,14.9,74,72,14.6,NA,NA,NA,NA,NA,NA,NA,NA,29.5,NA,NA,NA,73,69,14.2,NA,NA,NA,14.2,NA,NA,NA,76,74,15,NA,NA,NA,NA,76,74,15,30,73.7,0,73.7,3,2015,6,28,6/17/2015,11
100,DCI All-Star Review,"Bowling Green, OH",Bowling Green,OH,6/28/2015,Boston Crusaders,73,66,13.9,71,68,13.9,NA,NA,NA,NA,NA,NA,NA,NA,27.8,NA,NA,NA,69,65,13.4,NA,NA,NA,13.4,NA,NA,NA,70,67,13.7,NA,NA,NA,NA,68,66,13.4,27.1,68.3,0,68.3,4,2015,6,28,6/20/2015,8
101,DCI All-Star Review,"Bowling Green, OH",Bowling Green,OH,6/28/2015,Crossmen,72,68,14,72,69,14.1,NA,NA,NA,NA,NA,NA,NA,NA,28.1,NA,NA,NA,63,61,12.4,NA,NA,NA,12.4,NA,NA,NA,71,71,14.2,NA,NA,NA,NA,65,63,12.8,27,67.5,0,67.5,5,2015,6,28,6/19/2015,9
102,DCI All-Star Review,"Bowling Green, OH",Bowling Green,OH,6/28/2015,Troopers,71,65,13.6,68,65,13.3,NA,NA,NA,NA,NA,NA,NA,NA,26.9,NA,NA,NA,64,62,12.6,NA,NA,NA,12.6,NA,NA,NA,72,69,14.1,NA,NA,NA,NA,63,64,12.7,26.8,66.3,0,66.3,6,2015,6,28,6/19/2015,9
103,DCI All-Star Review,"Bowling Green, OH",Bowling Green,OH,6/28/2015,Spirit of Atlanta,67,64,13.1,69,67,13.6,NA,NA,NA,NA,NA,NA,NA,NA,26.7,NA,NA,NA,65,60,12.5,NA,NA,NA,12.5,NA,NA,NA,68,64,13.2,NA,NA,NA,NA,64,62,12.6,25.8,65,0,65,7,2015,6,28,6/20/2015,8
104,Drums Across the Desert,"Mesa, AZ",Mesa,AZ,6/29/2015,Santa Clara Vanguard,80,79,15.9,80,78,15.8,NA,NA,NA,NA,NA,NA,NA,NA,31.7,NA,NA,NA,81,79,16,NA,NA,NA,16,NA,NA,NA,80,78,15.8,NA,NA,NA,NA,81,79,16,31.8,79.5,0,79.5,1,2015,6,29,6/19/2015,10
105,Drums Across the Desert,"Mesa, AZ",Mesa,AZ,6/29/2015,Phantom Regiment,75,74,14.9,77,73,15,NA,NA,NA,NA,NA,NA,NA,NA,29.9,NA,NA,NA,76,74,15,NA,NA,NA,15,NA,NA,NA,74,71,14.5,NA,NA,NA,NA,76,74,15,29.5,74.4,0,74.4,2,2015,6,29,6/19/2015,10
106,Drums Across the Desert,"Mesa, AZ",Mesa,AZ,6/29/2015,The Academy,67,64,13.1,71,66,13.7,NA,NA,NA,NA,NA,NA,NA,NA,26.8,NA,NA,NA,70,67,13.7,NA,NA,NA,13.7,NA,NA,NA,70,67,13.7,NA,NA,NA,NA,68,65,13.3,27,67.5,0,67.5,3,2015,6,29,6/27/2015,2
107,Drum Corps: An American Tradition,"Allentown, PA",Allentown,PA,6/29/2015,The Cadets,82,81,16.3,82,80,16.2,NA,NA,NA,NA,NA,NA,NA,NA,32.5,NA,NA,NA,82,78,16,79,77,15.6,31.6,NA,NA,NA,80,77,15.7,NA,NA,NA,NA,NA,NA,NA,15.7,79.8,0,79.8,1,2015,6,29,6/17/2015,12
108,Drum Corps: An American Tradition,"Allentown, PA",Allentown,PA,6/29/2015,Carolina Crown,81,79,16,80,78,15.8,NA,NA,NA,NA,NA,NA,NA,NA,31.8,NA,NA,NA,80,79,15.9,82,80,16.2,32.1,NA,NA,NA,77,76,15.3,NA,NA,NA,NA,NA,NA,NA,15.3,79.2,0,79.2,2,2015,6,29,6/17/2015,12
109,Drum Corps: An American Tradition,"Allentown, PA",Allentown,PA,6/29/2015,Boston Crusaders,70,67,13.7,74,72,14.6,NA,NA,NA,NA,NA,NA,NA,NA,28.3,NA,NA,NA,72,67,13.9,76,74,15,28.9,NA,NA,NA,73,70,14.3,NA,NA,NA,NA,NA,NA,NA,14.3,71.5,0,71.5,3,2015,6,29,6/20/2015,9
110,Drum Corps: An American Tradition,"Allentown, PA",Allentown,PA,6/29/2015,Crossmen,72,70,14.2,73,71,14.4,NA,NA,NA,NA,NA,NA,NA,NA,28.6,NA,NA,NA,73,69,14.2,73,71,14.4,28.6,NA,NA,NA,71,71,14.2,NA,NA,NA,NA,NA,NA,NA,14.2,71.4,0,71.4,4,2015,6,29,6/19/2015,10
111,Drum Corps: An American Tradition,"Allentown, PA",Allentown,PA,6/29/2015,Troopers,68,66,13.4,72,70,14.2,NA,NA,NA,NA,NA,NA,NA,NA,27.6,NA,NA,NA,67,63,13,66,61,12.7,25.7,NA,NA,NA,69,72,14.1,NA,NA,NA,NA,NA,NA,NA,14.1,67.4,0,67.4,5,2015,6,29,6/19/2015,10
112,The Thunder of Drums,"Mankato, MN",Mankato,MN,6/29/2015,Bluecoats,80,77,15.7,79,77,15.6,NA,NA,NA,NA,NA,NA,NA,NA,31.3,NA,NA,NA,79,76,15.5,NA,NA,NA,15.5,NA,NA,NA,81,76,15.7,NA,NA,NA,NA,83,81,16.4,32.1,78.9,0,78.9,1,2015,6,29,6/17/2015,12
113,The Thunder of Drums,"Mankato, MN",Mankato,MN,6/29/2015,Madison Scouts,72,68,14,73,72,14.5,NA,NA,NA,NA,NA,NA,NA,NA,28.5,NA,NA,NA,72,69,14.1,NA,NA,NA,14.1,NA,NA,NA,73,70,14.3,NA,NA,NA,NA,72,70,14.2,28.5,71.1,0,71.1,2,2015,6,29,6/17/2015,12
114,The Thunder of Drums,"Mankato, MN",Mankato,MN,6/29/2015,Colts,68,63,13.1,64,60,12.4,NA,NA,NA,NA,NA,NA,NA,NA,25.5,NA,NA,NA,70,68,13.8,NA,NA,NA,13.8,NA,NA,NA,67,65,13.2,NA,NA,NA,NA,68,65,13.3,26.5,65.8,0,65.8,3,2015,6,29,6/20/2015,9
115,The Thunder of Drums,"Mankato, MN",Mankato,MN,6/29/2015,Pioneer,58,53,11.1,58,54,11.2,NA,NA,NA,NA,NA,NA,NA,NA,22.3,NA,NA,NA,65,61,12.6,NA,NA,NA,12.6,NA,NA,NA,53,49,10.2,NA,NA,NA,NA,61,60,12.1,22.3,57.2,0,57.2,4,2015,6,29,6/23/2015,6
116,Brass Impact,"Olathe, KS",Olathe,KS,7/1/2015,Santa Clara Vanguard,81,80,16.1,82,78,16,NA,NA,NA,NA,NA,NA,NA,NA,32.1,NA,NA,NA,83,80,16.3,NA,NA,NA,16.3,NA,NA,NA,84,82,16.6,NA,NA,NA,NA,83,82,16.5,33.1,81.5,0,81.5,1,2015,7,1,6/19/2015,12
117,Brass Impact,"Olathe, KS",Olathe,KS,7/1/2015,Blue Stars,74,71,14.5,71,68,13.9,NA,NA,NA,NA,NA,NA,NA,NA,28.4,NA,NA,NA,72,68,14,NA,NA,NA,14,NA,NA,NA,74,74,14.8,NA,NA,NA,NA,75,71,14.6,29.4,71.8,0,71.8,2,2015,7,1,6/17/2015,14
118,Brass Impact,"Olathe, KS",Olathe,KS,7/1/2015,Spirit of Atlanta,67,64,13.1,67,65,13.2,NA,NA,NA,NA,NA,NA,NA,NA,26.3,NA,NA,NA,67,63,13,NA,NA,NA,13,NA,NA,NA,70,72,14.2,NA,NA,NA,NA,66,63,12.9,27.1,66.4,0,66.4,3,2015,7,1,6/20/2015,11
119,Brass Impact,"Olathe, KS",Olathe,KS,7/1/2015,Colts,66,63,12.9,66,63,12.9,NA,NA,NA,NA,NA,NA,NA,NA,25.8,NA,NA,NA,69,64,13.3,NA,NA,NA,13.3,NA,NA,NA,68,66,13.4,NA,NA,NA,NA,69,67,13.6,27,66.1,0,66.1,4,2015,7,1,6/20/2015,11
120,Drums of Fire,"McMinnville, OR",McMinnville,OR,7/2/2015,Blue Knights,75,72,14.7,78,72,15,NA,NA,NA,NA,NA,NA,NA,NA,29.7,NA,NA,NA,74,72,14.6,NA,NA,NA,14.6,NA,NA,NA,78,75,15.3,NA,NA,NA,NA,77,74,15.1,30.4,74.7,0,74.7,1,2015,7,2,6/19/2015,13
121,Drums of Fire,"McMinnville, OR",McMinnville,OR,7/2/2015,Oregon Crusaders,59,53,11.2,66,60,12.6,NA,NA,NA,NA,NA,NA,NA,NA,23.8,NA,NA,NA,58,55,11.3,NA,NA,NA,11.3,NA,NA,NA,60,56,11.6,NA,NA,NA,NA,69,67,13.6,25.2,60.3,0,60.3,2,2015,7,2,7/2/2015,0
122,Celebration In Brass,"Waukee, IA",Waukee,IA,7/2/2015,Santa Clara Vanguard,79,76,15.5,83,81,16.4,NA,NA,NA,NA,NA,NA,NA,NA,31.9,NA,NA,NA,78,76,15.4,NA,NA,NA,15.4,79,77,15.6,81,79,16,NA,NA,NA,NA,NA,NA,NA,31.6,78.9,0,78.9,1,2015,7,2,6/19/2015,13
123,Celebration In Brass,"Waukee, IA",Waukee,IA,7/2/2015,The Cavaliers,76,73,14.9,76,74,15,NA,NA,NA,NA,NA,NA,NA,NA,29.9,NA,NA,NA,75,73,14.8,NA,NA,NA,14.8,75,72,14.7,76,75,15.1,NA,NA,NA,NA,NA,NA,NA,29.8,74.5,0,74.5,2,2015,7,2,6/17/2015,15
124,Celebration In Brass,"Waukee, IA",Waukee,IA,7/2/2015,Blue Stars,73,68,14.1,73,71,14.4,NA,NA,NA,NA,NA,NA,NA,NA,28.5,NA,NA,NA,70,66,13.6,NA,NA,NA,13.6,71,68,13.9,72,69,14.1,NA,NA,NA,NA,NA,NA,NA,28,70.1,0,70.1,3,2015,7,2,6/17/2015,15
125,Celebration In Brass,"Waukee, IA",Waukee,IA,7/2/2015,Colts,66,62,12.8,69,67,13.6,NA,NA,NA,NA,NA,NA,NA,NA,26.4,NA,NA,NA,72,69,14.1,NA,NA,NA,14.1,67,65,13.2,68,68,13.6,NA,NA,NA,NA,NA,NA,NA,26.8,67.3,0,67.3,4,2015,7,2,6/20/2015,12
126,Celebration In Brass,"Waukee, IA",Waukee,IA,7/2/2015,Spirit of Atlanta,68,64,13.2,70,68,13.8,NA,NA,NA,NA,NA,NA,NA,NA,27,NA,NA,NA,68,62,13,NA,NA,NA,13,68,66,13.4,69,66,13.5,NA,NA,NA,NA,NA,NA,NA,26.9,66.9,0,66.9,5,2015,7,2,6/20/2015,12
127,East Coast Classic,"Foxboro, MA",Foxboro,MA,7/2/2015,Blue Devils,82,82,16.4,79,78,15.7,NA,NA,NA,NA,NA,NA,NA,NA,32.1,82,80,16.2,83,81,16.4,83,82,16.5,24.55,81,80,16.1,83,78,16.1,NA,NA,NA,NA,83,83,16.6,24.4,81.05,0,81.05,1,2015,7,2,6/19/2015,13
128,East Coast Classic,"Foxboro, MA",Foxboro,MA,7/2/2015,The Cadets,83,80,16.3,80,76,15.6,NA,NA,NA,NA,NA,NA,NA,NA,31.9,80,76,15.6,82,79,16.1,81,79,16,23.85,82,81,16.3,84,79,16.3,NA,NA,NA,NA,84,81,16.5,24.55,80.3,0,80.3,2,2015,7,2,6/17/2015,15
129,East Coast Classic,"Foxboro, MA",Foxboro,MA,7/2/2015,Carolina Crown,79,81,16,78,80,15.8,NA,NA,NA,NA,NA,NA,NA,NA,31.8,81,78,15.9,80,80,16,82,80,16.2,24.05,80,79,15.9,82,76,15.8,NA,NA,NA,NA,81,82,16.3,24,79.85,0,79.85,3,2015,7,2,6/17/2015,15
130,East Coast Classic,"Foxboro, MA",Foxboro,MA,7/2/2015,Boston Crusaders,72,71,14.3,74,73,14.7,NA,NA,NA,NA,NA,NA,NA,NA,29,76,72,14.8,72,69,14.1,75,73,14.8,21.85,74,73,14.7,71,65,13.6,NA,NA,NA,NA,70,68,13.8,21.05,71.9,0,71.9,4,2015,7,2,6/20/2015,12
131,East Coast Classic,"Foxboro, MA",Foxboro,MA,7/2/2015,Crossmen,74,73,14.7,73,71,14.4,NA,NA,NA,NA,NA,NA,NA,NA,29.1,75,70,14.5,75,72,14.7,73,71,14.4,21.8,73,72,14.5,72,66,13.8,NA,NA,NA,NA,66,64,13,20.65,71.55,0,71.55,5,2015,7,2,6/19/2015,13
132,East Coast Classic,"Foxboro, MA",Foxboro,MA,7/2/2015,Troopers,70,70,14,70,72,14.2,NA,NA,NA,NA,NA,NA,NA,NA,28.2,70,66,13.6,68,65,13.3,68,64,13.2,20.05,68,67,13.5,70,69,13.9,NA,NA,NA,NA,67,66,13.3,20.35,68.6,0,68.6,6,2015,7,2,6/19/2015,13
133,East Coast Classic,"Foxboro, MA",Foxboro,MA,7/2/2015,Jersey Surf,61,57,11.8,63,61,12.4,NA,NA,NA,NA,NA,NA,NA,NA,24.2,62,58,12,60,56,11.6,65,61,12.6,18.1,60,59,11.9,61,58,11.9,NA,NA,NA,NA,60,58,11.8,17.8,60.1,0,60.1,7,2015,7,2,7/2/2015,0
134,Seattle Summer Music Games,"Renton, WA",Renton,WA,7/3/2015,Blue Knights,77,76,15.3,78,76,15.4,NA,NA,NA,NA,NA,NA,NA,NA,30.7,NA,NA,NA,73,73,14.6,NA,NA,NA,14.6,NA,NA,NA,79,72,15.1,NA,NA,NA,NA,77,75,15.2,30.3,75.6,0,75.6,1,2015,7,3,6/19/2015,14
135,Seattle Summer Music Games,"Renton, WA",Renton,WA,7/3/2015,Oregon Crusaders,55,59,11.4,63,61,12.4,NA,NA,NA,NA,NA,NA,NA,NA,23.8,NA,NA,NA,65,56,12.1,NA,NA,NA,12.1,NA,NA,NA,66,63,12.9,NA,NA,NA,NA,69,69,13.8,26.7,62.6,0,62.6,2,2015,7,3,7/2/2015,1
136,Show of Shows,"Rockford, IL",Rockford,IL,7/3/2015,Bluecoats,81,78,15.9,82,80,16.2,NA,NA,NA,NA,NA,NA,NA,NA,32.1,NA,NA,NA,82,81,16.3,NA,NA,NA,16.3,80,78,15.8,80,77,15.7,NA,NA,NA,NA,NA,NA,NA,31.5,79.9,0,79.9,1,2015,7,3,6/17/2015,16
137,Show of Shows,"Rockford, IL",Rockford,IL,7/3/2015,The Cavaliers,79,76,15.5,76,73,14.9,NA,NA,NA,NA,NA,NA,NA,NA,30.4,NA,NA,NA,78,75,15.3,NA,NA,NA,15.3,76,73,14.9,77,72,14.9,NA,NA,NA,NA,NA,NA,NA,29.8,75.5,0,75.5,2,2015,7,3,6/17/2015,16
138,Show of Shows,"Rockford, IL",Rockford,IL,7/3/2015,Phantom Regiment,75,69,14.4,74,72,14.6,NA,NA,NA,NA,NA,NA,NA,NA,29,NA,NA,NA,74,71,14.5,NA,NA,NA,14.5,74,74,14.8,72,67,13.9,NA,NA,NA,NA,NA,NA,NA,28.7,72.2,0,72.2,3,2015,7,3,6/19/2015,14
139,Show of Shows,"Rockford, IL",Rockford,IL,7/3/2015,Spirit of Atlanta,65,64,12.9,69,66,13.5,NA,NA,NA,NA,NA,NA,NA,NA,26.4,NA,NA,NA,69,66,13.5,NA,NA,NA,13.5,70,68,13.8,67,63,13,NA,NA,NA,NA,NA,NA,NA,26.8,66.7,0,66.7,4,2015,7,3,6/20/2015,13
140,Rotary Music Festival,"Cedarburg, WI",Cedarburg,WI,7/3/2015,Madison Scouts,73,73,14.6,72,71,14.3,NA,NA,NA,NA,NA,NA,NA,NA,28.9,NA,NA,NA,76,73,14.9,76,73,14.9,29.8,NA,NA,NA,76,74,15,NA,NA,NA,NA,NA,NA,NA,15,73.7,0,73.7,1,2015,7,3,6/17/2015,16
141,Rotary Music Festival,"Cedarburg, WI",Cedarburg,WI,7/3/2015,Blue Stars,75,70,14.5,75,70,14.5,NA,NA,NA,NA,NA,NA,NA,NA,29,NA,NA,NA,70,68,13.8,78,74,15.2,29,NA,NA,NA,75,73,14.8,NA,NA,NA,NA,NA,NA,NA,14.8,72.8,0,72.8,2,2015,7,3,6/17/2015,16
142,Rotary Music Festival,"Cedarburg, WI",Cedarburg,WI,7/3/2015,Colts,74,69,14.3,73,69,14.2,NA,NA,NA,NA,NA,NA,NA,NA,28.5,NA,NA,NA,73,70,14.3,72,70,14.2,28.5,NA,NA,NA,70,68,13.8,NA,NA,NA,NA,NA,NA,NA,13.8,70.8,0,70.8,3,2015,7,3,6/20/2015,13
143,Rotary Music Festival,"Cedarburg, WI",Cedarburg,WI,7/3/2015,Pioneer,64,59,12.3,57,55,11.2,NA,NA,NA,NA,NA,NA,NA,NA,23.5,NA,NA,NA,61,58,11.9,58,54,11.2,23.1,NA,NA,NA,56,54,11,NA,NA,NA,NA,NA,NA,NA,11,57.6,0,57.6,4,2015,7,3,6/23/2015,10
144,Summer Music Preview,"Briston, RI",Briston,RI,7/3/2015,Blue Devils,83,82,16.5,83,81,16.4,NA,NA,NA,NA,NA,NA,NA,NA,32.9,NA,NA,NA,83,81,16.4,NA,NA,NA,16.4,NA,NA,NA,83,82,16.5,NA,NA,NA,NA,84,83,16.7,33.2,82.5,0,82.5,1,2015,7,3,6/19/2015,14
145,Summer Music Preview,"Briston, RI",Briston,RI,7/3/2015,The Cadets,82,80,16.2,82,80,16.2,NA,NA,NA,NA,NA,NA,NA,NA,32.4,NA,NA,NA,81,80,16.1,NA,NA,NA,16.1,NA,NA,NA,84,80,16.4,NA,NA,NA,NA,85,84,16.9,33.3,81.8,0,81.8,2,2015,7,3,6/17/2015,16
146,Summer Music Preview,"Briston, RI",Briston,RI,7/3/2015,Crossmen,76,72,14.8,74,72,14.6,NA,NA,NA,NA,NA,NA,NA,NA,29.4,NA,NA,NA,74,71,14.5,NA,NA,NA,14.5,NA,NA,NA,75,70,14.5,NA,NA,NA,NA,68,65,13.3,27.8,71.7,0,71.7,3,2015,7,3,6/19/2015,14
147,Summer Music Preview,"Briston, RI",Briston,RI,7/3/2015,Troopers,72,71,14.3,71,68,13.9,NA,NA,NA,NA,NA,NA,NA,NA,28.2,NA,NA,NA,69,64,13.3,NA,NA,NA,13.3,NA,NA,NA,74,72,14.6,NA,NA,NA,NA,69,66,13.5,28.1,69.6,0,69.6,4,2015,7,3,6/19/2015,14
148,Summer Music Preview,"Briston, RI",Briston,RI,7/3/2015,Jersey Surf,62,60,12.2,62,59,12.1,NA,NA,NA,NA,NA,NA,NA,NA,24.3,NA,NA,NA,59,54,11.3,NA,NA,NA,11.3,NA,NA,NA,66,64,13,NA,NA,NA,NA,61,60,12.1,25.1,60.7,0,60.7,5,2015,7,3,7/2/2015,1
149,The Beanpot Invitational - A DCI/DCA split event!,"Lynn,, MA",Lynn,MA,7/4/2015,The Cadets,83,82,16.5,84,80,16.4,NA,NA,NA,NA,NA,NA,NA,NA,32.9,NA,NA,NA,84,81,16.5,NA,NA,NA,16.5,82,81,16.3,85,81,16.6,NA,NA,NA,NA,NA,NA,NA,32.9,82.3,0,82.3,1,2015,7,4,6/17/2015,17
150,The Beanpot Invitational - A DCI/DCA split event!,"Lynn,, MA",Lynn,MA,7/4/2015,Carolina Crown,81,81,16.2,82,80,16.2,NA,NA,NA,NA,NA,NA,NA,NA,32.4,NA,NA,NA,82,82,16.4,NA,NA,NA,16.4,81,80,16.1,83,79,16.2,NA,NA,NA,NA,NA,NA,NA,32.3,81.1,0,81.1,2,2015,7,4,6/17/2015,17
151,The Beanpot Invitational - A DCI/DCA split event!,"Lynn,, MA",Lynn,MA,7/4/2015,Crossmen,75,73,14.8,75,72,14.7,NA,NA,NA,NA,NA,NA,NA,NA,29.5,NA,NA,NA,76,72,14.8,NA,NA,NA,14.8,75,73,14.8,74,69,14.3,NA,NA,NA,NA,NA,NA,NA,29.1,73.4,0,73.4,3,2015,7,4,6/19/2015,15
152,The Beanpot Invitational - A DCI/DCA split event!,"Lynn,, MA",Lynn,MA,7/4/2015,Troopers,73,71,14.4,73,69,14.2,NA,NA,NA,NA,NA,NA,NA,NA,28.6,NA,NA,NA,73,68,14.1,NA,NA,NA,14.1,73,72,14.5,73,71,14.4,NA,NA,NA,NA,NA,NA,NA,28.9,71.6,0,71.6,4,2015,7,4,6/19/2015,15
153,The Beanpot Invitational - A DCI/DCA split event!,"Lynn,, MA",Lynn,MA,7/4/2015,Jersey Surf,62,60,12.2,63,60,12.3,NA,NA,NA,NA,NA,NA,NA,NA,24.5,NA,NA,NA,58,62,12,NA,NA,NA,12,63,61,12.4,64,61,12.5,NA,NA,NA,NA,NA,NA,NA,24.9,61.4,0,61.4,5,2015,7,4,7/2/2015,2
154,The Whitewater Classic,"Whitewater, WI",Whitewater,WI,7/5/2015,Bluecoats,80,79,15.9,81,79,16,NA,NA,NA,NA,NA,NA,NA,NA,31.9,78,74,15.2,81,80,16.1,80,78,15.8,23.55,81,77,15.8,82,80,16.2,NA,NA,NA,NA,81,79,16,24,79.45,0,79.45,1,2015,7,5,6/17/2015,18
155,The Whitewater Classic,"Whitewater, WI",Whitewater,WI,7/5/2015,Santa Clara Vanguard,78,76,15.4,82,80,16.2,NA,NA,NA,NA,NA,NA,NA,NA,31.6,79,76,15.5,79,78,15.7,79,75,15.4,23.3,80,79,15.9,81,79,16,NA,NA,NA,NA,83,80,16.3,24.1,79,0,79,2,2015,7,5,6/19/2015,16
156,The Whitewater Classic,"Whitewater, WI",Whitewater,WI,7/5/2015,The Cavaliers,76,74,15,77,75,15.2,NA,NA,NA,NA,NA,NA,NA,NA,30.2,76,73,14.9,75,71,14.6,78,74,15.2,22.35,78,73,15.1,78,76,15.4,NA,NA,NA,NA,79,75,15.4,22.95,75.5,0,75.5,3,2015,7,5,6/17/2015,18
157,The Whitewater Classic,"Whitewater, WI",Whitewater,WI,7/5/2015,Phantom Regiment,74,72,14.6,74,74,14.8,NA,NA,NA,NA,NA,NA,NA,NA,29.4,74,70,14.4,73,72,14.5,76,73,14.9,21.9,77,75,15.2,76,72,14.8,NA,NA,NA,NA,75,73,14.8,22.4,73.7,0,73.7,4,2015,7,5,6/19/2015,16
158,The Whitewater Classic,"Whitewater, WI",Whitewater,WI,7/5/2015,Madison Scouts,73,71,14.4,73,73,14.6,NA,NA,NA,NA,NA,NA,NA,NA,29,66,62,12.8,70,73,14.3,77,73,15,21.05,74,71,14.5,73,70,14.3,NA,NA,NA,NA,73,72,14.5,21.65,71.7,0,71.7,5,2015,7,5,6/17/2015,18
159,The Whitewater Classic,"Whitewater, WI",Whitewater,WI,7/5/2015,Blue Stars,71,69,14,71,71,14.2,NA,NA,NA,NA,NA,NA,NA,NA,28.2,67,63,13,71,69,14,75,72,14.7,20.85,75,72,14.7,74,71,14.5,NA,NA,NA,NA,76,71,14.7,21.95,71,0,71,6,2015,7,5,6/17/2015,18
160,The Whitewater Classic,"Whitewater, WI",Whitewater,WI,7/5/2015,Colts,68,64,13.2,72,68,14,NA,NA,NA,NA,NA,NA,NA,NA,27.2,68,64,13.2,66,64,13,73,71,14.4,20.3,70,66,13.6,72,69,14.1,NA,NA,NA,NA,70,66,13.6,20.65,68.15,0,68.15,7,2015,7,5,6/20/2015,15
161,The Whitewater Classic,"Whitewater, WI",Whitewater,WI,7/5/2015,Pioneer,64,60,12.4,52,50,10.2,NA,NA,NA,NA,NA,NA,NA,NA,22.6,62,59,12.1,60,53,11.3,58,52,11,17.2,60,55,11.5,63,60,12.3,NA,NA,NA,NA,57,55,11.2,17.5,57.3,0,57.3,8,2015,7,5,6/23/2015,12
162,Drum Corps: An American Tradition,"Clifton, NJ",Clifton,NJ,7/5/2015,Blue Devils,83,80,16.3,84,81,16.5,NA,NA,NA,NA,NA,NA,NA,NA,32.8,84,79,16.3,86,84,17,85,81,16.6,24.95,82,81,16.3,83,83,16.6,NA,NA,NA,NA,86,82,16.8,24.85,82.6,0,82.6,1,2015,7,5,6/19/2015,16
163,Drum Corps: An American Tradition,"Clifton, NJ",Clifton,NJ,7/5/2015,The Cadets,82,82,16.4,85,82,16.7,NA,NA,NA,NA,NA,NA,NA,NA,33.1,83,78,16.1,85,81,16.6,83,82,16.5,24.6,83,82,16.5,82,81,16.3,NA,NA,NA,NA,85,84,16.9,24.85,82.55,0,82.55,2,2015,7,5,6/17/2015,18
164,Drum Corps: An American Tradition,"Clifton, NJ",Clifton,NJ,7/5/2015,Carolina Crown,81,80,16.1,82,82,16.4,NA,NA,NA,NA,NA,NA,NA,NA,32.5,82,82,16.4,84,83,16.7,84,83,16.7,24.9,81,80,16.1,82,82,16.4,NA,NA,NA,NA,82,79,16.1,24.3,81.7,0,81.7,3,2015,7,5,6/17/2015,18
165,Drum Corps: An American Tradition,"Clifton, NJ",Clifton,NJ,7/5/2015,Boston Crusaders,77,75,15.2,76,74,15,NA,NA,NA,NA,NA,NA,NA,NA,30.2,77,69,14.6,76,74,15,78,75,15.3,22.45,78,76,15.4,76,74,15,NA,NA,NA,NA,76,74,15,22.7,75.35,0,75.35,4,2015,7,5,6/20/2015,15
166,Drum Corps: An American Tradition,"Clifton, NJ",Clifton,NJ,7/5/2015,Jersey Surf,61,52,11.3,64,62,12.6,NA,NA,NA,NA,NA,NA,NA,NA,23.9,61,64,12.5,62,65,12.7,66,61,12.7,18.95,68,66,13.4,62,59,12.1,NA,NA,NA,NA,64,62,12.6,19.05,61.9,0,61.9,5,2015,7,5,7/2/2015,3
167,DCI Capital Classic Corps Show,"Sacramento, CA",Sacramento,CA,7/5/2015,Mandarins,68,62,13,64,62,12.6,NA,NA,NA,NA,NA,NA,NA,NA,25.6,NA,NA,NA,68,67,13.5,NA,NA,NA,13.5,NA,NA,NA,68,64,13.2,NA,NA,NA,NA,62,57,11.9,25.1,64.2,0,64.2,1,2015,7,5,6/19/2015,16
168,Drums Along the Columbia,"Tri Cities, WA",Tri Cities,WA,7/6/2015,Blue Knights,78,76,15.4,82,78,16,NA,NA,NA,NA,NA,NA,NA,NA,31.4,NA,NA,NA,78,75,15.3,NA,NA,NA,15.3,NA,NA,NA,79,76,15.5,NA,NA,NA,NA,79,77,15.6,31.1,77.8,0,77.8,1,2015,7,6,6/19/2015,17
169,Drums Along the Columbia,"Tri Cities, WA",Tri Cities,WA,7/6/2015,Oregon Crusaders,60,58,11.8,67,64,13.1,NA,NA,NA,NA,NA,NA,NA,NA,24.9,NA,NA,NA,68,62,13,NA,NA,NA,13,NA,NA,NA,70,66,13.6,NA,NA,NA,NA,66,64,13,26.6,64.5,0,64.5,2,2015,7,6,7/2/2015,4
170,Drums Along the Columbia,"Tri Cities, WA",Tri Cities,WA,7/6/2015,Blue Knights,78,76,15.4,82,78,16,NA,NA,NA,NA,NA,NA,NA,NA,31.4,NA,NA,NA,78,75,15.3,NA,NA,NA,15.3,NA,NA,NA,79,76,15.5,NA,NA,NA,NA,79,77,15.6,31.1,77.8,0,77.8,1,2015,7,6,6/19/2015,17
171,Drums Along the Columbia,"Tri Cities, WA",Tri Cities,WA,7/6/2015,Oregon Crusaders,60,58,11.8,67,64,13.1,NA,NA,NA,NA,NA,NA,NA,NA,24.9,NA,NA,NA,68,62,13,NA,NA,NA,13,NA,NA,NA,70,66,13.6,NA,NA,NA,NA,66,64,13,26.6,64.5,0,64.5,2,2015,7,6,7/2/2015,4
172,Drums Along the Rockies - Boise Edition,"Boise, ID",Boise,ID,7/7/2015,Blue Knights,83,79,16.2,80,78,15.8,NA,NA,NA,NA,NA,NA,NA,NA,32,NA,NA,NA,81,77,15.8,NA,NA,NA,15.8,NA,NA,NA,80,77,15.7,NA,NA,NA,NA,78,76,15.4,31.1,78.9,0,78.9,1,2015,7,7,6/19/2015,18
173,Drums Along the Rockies - Boise Edition,"Boise, ID",Boise,ID,7/7/2015,The Academy,76,72,14.8,74,71,14.5,NA,NA,NA,NA,NA,NA,NA,NA,29.3,NA,NA,NA,73,70,14.3,NA,NA,NA,14.3,NA,NA,NA,73,70,14.3,NA,NA,NA,NA,71,65,13.6,27.9,71.5,0,71.5,2,2015,7,7,6/27/2015,10
174,Drums Along the Rockies - Boise Edition,"Boise, ID",Boise,ID,7/7/2015,Oregon Crusaders,69,65,13.4,67,64,13.1,NA,NA,NA,NA,NA,NA,NA,NA,26.5,NA,NA,NA,67,61,12.8,NA,NA,NA,12.8,NA,NA,NA,71,68,13.9,NA,NA,NA,NA,72,67,13.9,27.8,67.1,0,67.1,3,2015,7,7,7/2/2015,5
175,Music On The March,"Dubuque, IA",Dubuque,IA,7/7/2015,Bluecoats,81,78,15.9,82,79,16.1,NA,NA,NA,NA,NA,NA,NA,NA,32,81,75,15.6,84,81,16.5,83,80,16.3,24.2,80,78,15.8,84,81,16.5,NA,NA,NA,NA,81,79,16,24.15,80.35,0,80.35,1,2015,7,7,6/17/2015,20
176,Music On The March,"Dubuque, IA",Dubuque,IA,7/7/2015,Phantom Regiment,77,73,15,77,74,15.1,NA,NA,NA,NA,NA,NA,NA,NA,30.1,77,74,15.1,80,76,15.6,76,75,15.1,22.9,78,75,15.3,77,74,15.1,NA,NA,NA,NA,78,74,15.2,22.8,75.8,0,75.8,2,2015,7,7,6/19/2015,18
177,Music On The March,"Dubuque, IA",Dubuque,IA,7/7/2015,Troopers,70,65,13.5,72,70,14.2,NA,NA,NA,NA,NA,NA,NA,NA,27.7,71,64,13.5,74,70,14.4,72,70,14.2,21.05,72,70,14.2,74,72,14.6,NA,NA,NA,NA,71,69,14,21.4,70.15,0,70.15,3,2015,7,7,6/19/2015,18
178,Music On The March,"Dubuque, IA",Dubuque,IA,7/7/2015,Colts,67,64,13.1,71,69,14,NA,NA,NA,NA,NA,NA,NA,NA,27.1,67,61,12.8,77,72,14.9,77,73,15,21.35,70,69,13.9,73,71,14.4,NA,NA,NA,NA,70,67,13.7,21,69.45,0,69.45,4,2015,7,7,6/20/2015,17
179,Music On The March,"Dubuque, IA",Dubuque,IA,7/7/2015,Spirit of Atlanta,71,67,13.8,70,68,13.8,NA,NA,NA,NA,NA,NA,NA,NA,27.6,69,62,13.1,71,68,13.9,69,67,13.6,20.3,71,66,13.7,69,68,13.7,NA,NA,NA,NA,68,65,13.3,20.35,68.25,0,68.25,5,2015,7,7,6/20/2015,17
180,River City Rhapsody - Wausau,"Wausau, WI",Wausau,WI,7/7/2015,Madison Scouts,74,74,14.8,70,72,14.2,NA,NA,NA,NA,NA,NA,NA,NA,29,NA,NA,NA,74,73,14.7,NA,NA,NA,14.7,NA,NA,NA,74,72,14.6,NA,NA,NA,NA,80,77,15.7,30.3,74,0,74,1,2015,7,7,6/17/2015,20
181,River City Rhapsody - Wausau,"Wausau, WI",Wausau,WI,7/7/2015,Blue Stars,75,71,14.6,74,69,14.3,NA,NA,NA,NA,NA,NA,NA,NA,28.9,NA,NA,NA,72,71,14.3,NA,NA,NA,14.3,NA,NA,NA,75,73,14.8,NA,NA,NA,NA,78,75,15.3,30.1,73.3,0,73.3,2,2015,7,7,6/17/2015,20
182,River City Rhapsody - Wausau,"Wausau, WI",Wausau,WI,7/7/2015,Pioneer,64,57,12.1,54,52,10.6,NA,NA,NA,NA,NA,NA,NA,NA,22.7,NA,NA,NA,58,53,11.1,NA,NA,NA,11.1,NA,NA,NA,61,54,11.5,NA,NA,NA,NA,62,59,12.1,23.6,57.4,0,57.4,3,2015,7,7,6/23/2015,14
183,Corps Encore,"Ogden, UT",Ogden,UT,7/8/2015,Blue Knights,80,79,15.9,82,79,16.1,NA,NA,NA,NA,NA,NA,NA,NA,32,NA,NA,NA,81,78,15.9,NA,NA,NA,15.9,NA,NA,NA,80,77,15.7,NA,NA,NA,NA,80,78,15.8,31.5,79.4,0,79.4,1,2015,7,8,6/19/2015,19
184,Corps Encore,"Ogden, UT",Ogden,UT,7/8/2015,The Academy,71,70,14.1,74,71,14.5,NA,NA,NA,NA,NA,NA,NA,NA,28.6,NA,NA,NA,71,70,14.1,NA,NA,NA,14.1,NA,NA,NA,72,72,14.4,NA,NA,NA,NA,71,67,13.8,28.2,70.9,0,70.9,2,2015,7,8,6/27/2015,11
185,Corps Encore,"Ogden, UT",Ogden,UT,7/8/2015,Pacific Crest,68,67,13.5,69,68,13.7,NA,NA,NA,NA,NA,NA,NA,NA,27.2,NA,NA,NA,73,69,14.2,NA,NA,NA,14.2,NA,NA,NA,73,70,14.3,NA,NA,NA,NA,69,66,13.5,27.8,69.2,0,69.2,3,2015,7,8,6/19/2015,19
186,Corps Encore,"Ogden, UT",Ogden,UT,7/8/2015,Oregon Crusaders,66,65,13.1,67,65,13.2,NA,NA,NA,NA,NA,NA,NA,NA,26.3,NA,NA,NA,67,62,12.9,NA,NA,NA,12.9,NA,NA,NA,71,67,13.8,NA,NA,NA,NA,72,69,14.1,27.9,67.1,0,67.1,4,2015,7,8,7/2/2015,6
187,DCI Ft. Wayne,"Ft. Wayne, IN",Ft. Wayne,IN,7/8/2015,Blue Devils,86,84,17,84,83,16.7,NA,NA,NA,NA,NA,NA,NA,NA,33.7,83,82,16.5,88,86,17.4,83,83,16.6,25.25,83,82,16.5,84,82,16.6,NA,NA,NA,NA,83,81,16.4,24.75,83.7,0,83.7,1,2015,7,8,6/19/2015,19
188,DCI Ft. Wayne,"Ft. Wayne, IN",Ft. Wayne,IN,7/8/2015,Carolina Crown,84,83,16.7,84,84,16.8,NA,NA,NA,NA,NA,NA,NA,NA,33.5,84,79,16.3,86,83,16.9,85,84,16.9,25.05,83,81,16.4,83,81,16.4,NA,NA,NA,NA,81,78,15.9,24.35,82.9,0,82.9,2,2015,7,8,6/17/2015,21
189,DCI Ft. Wayne,"Ft. Wayne, IN",Ft. Wayne,IN,7/8/2015,Crossmen,75,73,14.8,73,71,14.4,NA,NA,NA,NA,NA,NA,NA,NA,29.2,77,74,15.1,76,75,15.1,77,75,15.2,22.7,76,74,15,73,70,14.3,NA,NA,NA,NA,67,65,13.2,21.25,73.15,0,73.15,3,2015,7,8,6/19/2015,19
190,DCI Ft. Wayne,"Ft. Wayne, IN",Ft. Wayne,IN,7/8/2015,Jersey Surf,62,58,12,64,64,12.8,NA,NA,NA,NA,NA,NA,NA,NA,24.8,61,59,12,68,64,13.2,63,61,12.4,18.8,63,63,12.6,65,63,12.8,NA,NA,NA,NA,60,57,11.7,18.55,62.15,0,62.15,4,2015,7,8,7/2/2015,6
191,River City Rhapsody - La Crosse,"La Crosse, WI",La Crosse,WI,7/9/2015,Santa Clara Vanguard,84,83,16.7,84,84,16.8,NA,NA,NA,NA,NA,NA,NA,NA,33.5,82,79,16.1,83,81,16.4,83,78,16.1,24.3,82,80,16.2,80,80,16,NA,NA,NA,NA,86,82,16.8,24.5,82.3,0,82.3,1,2015,7,9,6/19/2015,20
192,River City Rhapsody - La Crosse,"La Crosse, WI",La Crosse,WI,7/9/2015,The Cavaliers,81,79,16,79,77,15.6,NA,NA,NA,NA,NA,NA,NA,NA,31.6,75,73,14.8,79,76,15.5,81,77,15.8,23.05,79,77,15.6,79,77,15.6,NA,NA,NA,NA,82,73,15.5,23.35,78,0,78,2,2015,7,9,6/17/2015,22
193,River City Rhapsody - La Crosse,"La Crosse, WI",La Crosse,WI,7/9/2015,Madison Scouts,76,75,15.1,75,75,15,NA,NA,NA,NA,NA,NA,NA,NA,30.1,69,63,13.2,77,72,14.9,78,73,15.1,21.6,77,75,15.2,76,75,15.1,NA,NA,NA,NA,80,77,15.7,23,74.7,0,74.7,3,2015,7,9,6/17/2015,22
194,River City Rhapsody - La Crosse,"La Crosse, WI",La Crosse,WI,7/9/2015,Blue Stars,75,75,15,74,73,14.7,NA,NA,NA,NA,NA,NA,NA,NA,29.7,70,65,13.5,75,71,14.6,76,71,14.7,21.4,78,76,15.4,75,73,14.8,NA,NA,NA,NA,81,75,15.6,22.9,74,0,74,4,2015,7,9,6/17/2015,22
195,River City Rhapsody - La Crosse,"La Crosse, WI",La Crosse,WI,7/9/2015,Jersey Surf,65,62,12.7,64,62,12.6,NA,NA,NA,NA,NA,NA,NA,NA,25.3,61,58,11.9,62,59,12.1,58,54,11.2,17.6,66,65,13.1,64,64,12.8,NA,NA,NA,NA,63,57,12,18.95,61.85,0,61.85,5,2015,7,9,7/2/2015,7
196,Drums Along the Rockies - Laramie Edition,"Laramie, WY",Laramie,WY,7/9/2015,Troopers,77,74,15.1,75,73,14.8,NA,NA,NA,NA,NA,NA,NA,NA,29.9,NA,NA,NA,77,75,15.2,NA,NA,NA,15.2,76,75,15.1,76,73,14.9,NA,NA,NA,NA,NA,NA,NA,30,75.1,0,75.1,1,2015,7,9,6/19/2015,20
197,Drums Along the Rockies - Laramie Edition,"Laramie, WY",Laramie,WY,7/9/2015,Colts,75,71,14.6,73,69,14.2,NA,NA,NA,NA,NA,NA,NA,NA,28.8,NA,NA,NA,75,73,14.8,NA,NA,NA,14.8,73,72,14.5,71,69,14,NA,NA,NA,NA,NA,NA,NA,28.5,72.1,0,72.1,2,2015,7,9,6/20/2015,19
198,Drums Along the Rockies - Laramie Edition,"Laramie, WY",Laramie,WY,7/9/2015,The Academy,73,72,14.5,72,72,14.4,NA,NA,NA,NA,NA,NA,NA,NA,28.9,NA,NA,NA,68,66,13.4,NA,NA,NA,13.4,75,74,14.9,75,72,14.7,NA,NA,NA,NA,NA,NA,NA,29.6,71.9,0,71.9,3,2015,7,9,6/27/2015,12
199,Drums Along the Rockies - Laramie Edition,"Laramie, WY",Laramie,WY,7/9/2015,Spirit of Atlanta,72,69,14.1,71,67,13.8,NA,NA,NA,NA,NA,NA,NA,NA,27.9,NA,NA,NA,69,71,14,NA,NA,NA,14,74,69,14.3,68,66,13.4,NA,NA,NA,NA,NA,NA,NA,27.7,69.6,0,69.6,4,2015,7,9,6/20/2015,19
200,Drums Along the Rockies - Laramie Edition,"Laramie, WY",Laramie,WY,7/9/2015,Pacific Crest,70,67,13.7,70,70,14,NA,NA,NA,NA,NA,NA,NA,NA,27.7,NA,NA,NA,67,63,13,NA,NA,NA,13,70,68,13.8,73,70,14.3,NA,NA,NA,NA,NA,NA,NA,28.1,68.8,0,68.8,5,2015,7,9,6/19/2015,20
201,Drums Along the Rockies - Casper Edition,"Casper, WY",Casper,WY,7/10/2015,Bluecoats,84,83,16.7,84,82,16.6,NA,NA,NA,NA,NA,NA,NA,NA,33.3,NA,NA,NA,86,83,16.9,NA,NA,NA,16.9,NA,NA,NA,85,82,16.7,NA,NA,NA,NA,83,81,16.4,33.1,83.3,0,83.3,1,2015,7,10,6/17/2015,23
202,Drums Along the Rockies - Casper Edition,"Casper, WY",Casper,WY,7/10/2015,Troopers,78,77,15.5,77,74,15.1,NA,NA,NA,NA,NA,NA,NA,NA,30.6,NA,NA,NA,77,74,15.1,NA,NA,NA,15.1,NA,NA,NA,75,72,14.7,NA,NA,NA,NA,75,74,14.9,29.6,75.3,0,75.3,2,2015,7,10,6/19/2015,21
203,Drums Along the Rockies - Casper Edition,"Casper, WY",Casper,WY,7/10/2015,Mandarins,71,70,14.1,72,70,14.2,NA,NA,NA,NA,NA,NA,NA,NA,28.3,NA,NA,NA,73,69,14.2,NA,NA,NA,14.2,NA,NA,NA,70,70,14,NA,NA,NA,NA,69,65,13.4,27.4,69.9,0,69.9,3,2015,7,10,6/19/2015,21
204,Drums Along the Rockies - Casper Edition,"Casper, WY",Casper,WY,7/10/2015,Oregon Crusaders,68,67,13.5,71,69,14,NA,NA,NA,NA,NA,NA,NA,NA,27.5,NA,NA,NA,68,64,13.2,NA,NA,NA,13.2,NA,NA,NA,73,71,14.4,NA,NA,NA,NA,72,70,14.2,28.6,69.3,0,69.3,4,2015,7,10,7/2/2015,8
205,Drums Along the Rockies,"Denver, CO",Denver,CO,7/11/2015,Bluecoats,86,83,16.9,85,83,16.8,NA,NA,NA,NA,NA,NA,NA,NA,33.7,84,82,16.6,85,83,16.8,84,81,16.5,24.95,83,81,16.4,84,81,16.5,NA,NA,NA,NA,85,83,16.8,24.85,83.5,0,83.5,1,2015,7,11,6/17/2015,24
206,Drums Along the Rockies,"Denver, CO",Denver,CO,7/11/2015,Blue Knights,81,78,15.9,82,80,16.2,NA,NA,NA,NA,NA,NA,NA,NA,32.1,80,77,15.7,81,79,16,80,77,15.7,23.7,80,78,15.8,82,79,16.1,NA,NA,NA,NA,82,80,16.2,24.05,79.85,0,79.85,2,2015,7,11,6/19/2015,22
207,Drums Along the Rockies,"Denver, CO",Denver,CO,7/11/2015,Troopers,76,74,15,78,76,15.4,NA,NA,NA,NA,NA,NA,NA,NA,30.4,78,74,15.2,76,74,15,77,74,15.1,22.65,76,74,15,76,74,15,NA,NA,NA,NA,77,73,15,22.5,75.55,0,75.55,3,2015,7,11,6/19/2015,22
208,Drums Along the Rockies,"Denver, CO",Denver,CO,7/11/2015,Colts,72,71,14.3,77,74,15.1,NA,NA,NA,NA,NA,NA,NA,NA,29.4,77,76,15.3,75,73,14.8,75,69,14.4,22.25,75,72,14.7,74,72,14.6,NA,NA,NA,NA,73,70,14.3,21.8,73.45,0,73.45,4,2015,7,11,6/20/2015,21
209,Drums Along the Rockies,"Denver, CO",Denver,CO,7/11/2015,The Academy,75,73,14.8,75,75,15,NA,NA,NA,NA,NA,NA,NA,NA,29.8,76,73,14.9,73,70,14.3,70,71,14.1,21.65,75,73,14.8,72,71,14.3,NA,NA,NA,NA,75,74,14.9,22,73.45,0,73.45,4,2015,7,11,6/27/2015,14
210,Drums Along the Rockies,"Denver, CO",Denver,CO,7/11/2015,Spirit of Atlanta,70,70,14,72,69,14.1,NA,NA,NA,NA,NA,NA,NA,NA,28.1,75,71,14.6,70,68,13.8,73,70,14.3,21.35,74,71,14.5,73,69,14.2,NA,NA,NA,NA,74,72,14.6,21.65,71.1,0,71.1,6,2015,7,11,6/20/2015,21
211,Drums Along the Rockies,"Denver, CO",Denver,CO,7/11/2015,Mandarins,73,69,14.2,73,71,14.4,NA,NA,NA,NA,NA,NA,NA,NA,28.6,74,69,14.3,68,64,13.2,70,63,13.3,20.4,70,67,13.7,67,63,13,NA,NA,NA,NA,69,66,13.5,20.1,69.1,0,69.1,7,2015,7,11,6/19/2015,22
212,Drums Along the Rockies,"Denver, CO",Denver,CO,7/11/2015,Oregon Crusaders,68,65,13.3,73,72,14.5,NA,NA,NA,NA,NA,NA,NA,NA,27.8,71,67,13.8,66,65,13.1,69,67,13.6,20.25,72,70,14.2,70,64,13.4,NA,NA,NA,NA,73,71,14.4,21,69.05,0,69.05,8,2015,7,11,7/2/2015,9
213,Drums Along the Rockies,"Denver, CO",Denver,CO,7/11/2015,Pacific Crest,71,67,13.8,72,70,14.2,NA,NA,NA,NA,NA,NA,NA,NA,28,73,72,14.5,67,66,13.3,67,64,13.1,20.45,71,68,13.9,68,65,13.3,NA,NA,NA,NA,71,69,14,20.6,69.05,0,69.05,8,2015,7,11,6/19/2015,22
214,DCI Minnesota,"Minneapolis, MN",Minneapolis,MN,7/11/2015,The Cadets,85,82,16.7,81,80,16.1,NA,NA,NA,NA,NA,NA,NA,NA,32.8,86,85,17.1,86,83,16.9,81,79,16,25,86,84,17,84,80,16.4,NA,NA,NA,NA,85,84,16.9,25.15,82.95,0,82.95,1,2015,7,11,6/17/2015,24
215,DCI Minnesota,"Minneapolis, MN",Minneapolis,MN,7/11/2015,Blue Devils,82,81,16.3,82,81,16.3,NA,NA,NA,NA,NA,NA,NA,NA,32.6,85,84,16.9,85,82,16.7,84,83,16.7,25.15,84,82,16.6,83,82,16.5,NA,NA,NA,NA,88,83,17.1,25.1,82.85,0,82.85,2,2015,7,11,6/19/2015,22
216,DCI Minnesota,"Minneapolis, MN",Minneapolis,MN,7/11/2015,Santa Clara Vanguard,84,80,16.4,79,79,15.8,NA,NA,NA,NA,NA,NA,NA,NA,32.2,83,81,16.4,87,85,17.2,82,80,16.2,24.9,80,76,15.6,80,81,16.1,NA,NA,NA,NA,87,85,17.2,24.45,81.55,0,81.55,3,2015,7,11,6/19/2015,22
217,DCI Minnesota,"Minneapolis, MN",Minneapolis,MN,7/11/2015,Carolina Crown,79,78,15.7,80,77,15.7,NA,NA,NA,NA,NA,NA,NA,NA,31.4,84,83,16.7,82,80,16.2,83,82,16.5,24.7,85,83,16.8,81,78,15.9,NA,NA,NA,NA,83,82,16.5,24.6,80.7,0,80.7,4,2015,7,11,6/17/2015,24
218,DCI Minnesota,"Minneapolis, MN",Minneapolis,MN,7/11/2015,The Cavaliers,78,73,15.1,78,76,15.4,NA,NA,NA,NA,NA,NA,NA,NA,30.5,80,79,15.9,83,81,16.4,75,71,14.6,23.45,81,78,15.9,78,76,15.4,NA,NA,NA,NA,82,79,16.1,23.7,77.65,0,77.65,5,2015,7,11,6/17/2015,24
219,DCI Minnesota,"Minneapolis, MN",Minneapolis,MN,7/11/2015,Phantom Regiment,75,74,14.9,77,75,15.2,NA,NA,NA,NA,NA,NA,NA,NA,30.1,81,77,15.8,78,75,15.3,79,76,15.5,23.3,78,77,15.5,76,72,14.8,NA,NA,NA,NA,78,76,15.4,22.85,76.25,0,76.25,6,2015,7,11,6/19/2015,22
220,DCI Minnesota,"Minneapolis, MN",Minneapolis,MN,7/11/2015,Blue Stars,74,67,14.1,74,68,14.2,NA,NA,NA,NA,NA,NA,NA,NA,28.3,78,75,15.3,73,71,14.4,77,72,14.9,22.3,75,73,14.8,77,70,14.7,NA,NA,NA,NA,80,78,15.8,22.65,73.25,0,73.25,7,2015,7,11,6/17/2015,24
221,DCI Minnesota,"Minneapolis, MN",Minneapolis,MN,7/11/2015,Madison Scouts,71,71,14.2,73,71,14.4,NA,NA,NA,NA,NA,NA,NA,NA,28.6,76,72,14.8,69,69,13.8,76,74,15,21.8,74,75,14.9,75,74,14.9,NA,NA,NA,NA,79,77,15.6,22.7,73.1,0,73.1,8,2015,7,11,6/17/2015,24
222,DCI Minnesota,"Minneapolis, MN",Minneapolis,MN,7/11/2015,Boston Crusaders,70,68,13.8,76,70,14.6,NA,NA,NA,NA,NA,NA,NA,NA,28.4,77,74,15.1,72,70,14.2,78,75,15.3,22.3,73,72,14.5,73,69,14.2,NA,NA,NA,NA,76,75,15.1,21.9,72.6,0,72.6,9,2015,7,11,6/20/2015,21
223,DCI Minnesota,"Minneapolis, MN",Minneapolis,MN,7/11/2015,Crossmen,73,70,14.3,71,69,14,NA,NA,NA,NA,NA,NA,NA,NA,28.3,74,73,14.7,74,72,14.6,74,73,14.7,22,71,71,14.2,71,68,13.9,NA,NA,NA,NA,72,70,14.2,21.15,71.45,0,71.45,10,2015,7,11,6/19/2015,22
224,DCI Minnesota,"Minneapolis, MN",Minneapolis,MN,7/11/2015,Jersey Surf,64,59,12.3,63,61,12.4,NA,NA,NA,NA,NA,NA,NA,NA,24.7,69,65,13.4,64,62,12.6,60,57,11.7,18.85,66,68,13.4,65,61,12.6,NA,NA,NA,NA,67,65,13.2,19.6,63.15,0,63.15,11,2015,7,11,7/2/2015,9
225,Tour of Champions - Northern Illinois,"DeKalb, IL",DeKalb,IL,7/12/2015,Blue Devils,85,83,16.8,84,82,16.6,NA,NA,NA,NA,NA,NA,NA,NA,33.4,86,83,16.9,87,84,17.1,86,82,16.8,25.4,83,80,16.3,84,83,16.7,NA,NA,NA,NA,87,83,17,25,83.8,0,83.8,1,2015,7,12,6/19/2015,23
226,Tour of Champions - Northern Illinois,"DeKalb, IL",DeKalb,IL,7/12/2015,The Cadets,84,81,16.5,85,83,16.8,NA,NA,NA,NA,NA,NA,NA,NA,33.3,87,84,17.1,88,86,17.4,82,81,16.3,25.4,84,78,16.2,85,81,16.6,NA,NA,NA,NA,86,85,17.1,24.95,83.65,0,83.65,2,2015,7,12,6/17/2015,25
227,Tour of Champions - Northern Illinois,"DeKalb, IL",DeKalb,IL,7/12/2015,Carolina Crown,82,78,16,83,81,16.4,NA,NA,NA,NA,NA,NA,NA,NA,32.4,84,81,16.5,86,87,17.3,85,84,16.9,25.35,85,79,16.4,82,79,16.1,NA,NA,NA,NA,84,81,16.5,24.5,82.25,0,82.25,3,2015,7,12,6/17/2015,25
228,Tour of Champions - Northern Illinois,"DeKalb, IL",DeKalb,IL,7/12/2015,Santa Clara Vanguard,86,80,16.6,82,80,16.2,NA,NA,NA,NA,NA,NA,NA,NA,32.8,83,80,16.3,85,82,16.7,83,83,16.6,24.8,80,77,15.7,83,80,16.3,NA,NA,NA,NA,85,84,16.9,24.45,82.05,0,82.05,4,2015,7,12,6/19/2015,23
229,Tour of Champions - Northern Illinois,"DeKalb, IL",DeKalb,IL,7/12/2015,Phantom Regiment,78,74,15.2,80,76,15.6,NA,NA,NA,NA,NA,NA,NA,NA,30.8,80,75,15.5,78,78,15.6,80,79,15.9,23.5,79,75,15.4,79,77,15.6,NA,NA,NA,NA,81,78,15.9,23.45,77.75,0,77.75,5,2015,7,12,6/19/2015,23
230,Tour of Champions - Northern Illinois,"DeKalb, IL",DeKalb,IL,7/12/2015,The Cavaliers,80,75,15.5,78,74,15.2,NA,NA,NA,NA,NA,NA,NA,NA,30.7,82,79,16.1,80,77,15.7,75,73,14.8,23.3,78,74,15.2,78,74,15.2,NA,NA,NA,NA,82,80,16.2,23.3,77.3,0,77.3,6,2015,7,12,6/17/2015,25
231,Tour of Champions - Northern Illinois,"DeKalb, IL",DeKalb,IL,7/12/2015,Boston Crusaders,76,71,14.7,76,71,14.7,NA,NA,NA,NA,NA,NA,NA,NA,29.4,75,73,14.8,76,72,14.8,76,74,15,22.3,75,68,14.3,76,72,14.8,NA,NA,NA,NA,79,76,15.5,22.3,74,0,74,7,2015,7,12,6/20/2015,22
232,Percussion on the Pearl,"Muscatine, IA",Muscatine,IA,7/12/2015,Blue Stars,76,74,15,74,73,14.7,NA,NA,NA,NA,NA,NA,NA,NA,29.7,79,76,15.5,75,74,14.9,79,74,15.3,22.85,76,74,15,76,74,15,NA,NA,NA,NA,84,80,16.4,23.2,75.75,0,75.75,1,2015,7,12,6/17/2015,25
233,Percussion on the Pearl,"Muscatine, IA",Muscatine,IA,7/12/2015,Madison Scouts,73,73,14.6,73,72,14.5,NA,NA,NA,NA,NA,NA,NA,NA,29.1,77,73,15,77,75,15.2,75,75,15,22.6,77,75,15.2,77,75,15.2,NA,NA,NA,NA,82,81,16.3,23.35,75.05,0,75.05,2,2015,7,12,6/17/2015,25
234,Percussion on the Pearl,"Muscatine, IA",Muscatine,IA,7/12/2015,Crossmen,75,72,14.7,73,71,14.4,NA,NA,NA,NA,NA,NA,NA,NA,29.1,76,75,15.1,74,72,14.6,76,73,14.9,22.3,75,73,14.8,71,70,14.1,NA,NA,NA,NA,76,73,14.9,21.9,73.3,0,73.3,3,2015,7,12,6/19/2015,23
235,Percussion on the Pearl,"Muscatine, IA",Muscatine,IA,7/12/2015,Jersey Surf,62,64,12.6,64,63,12.7,NA,NA,NA,NA,NA,NA,NA,NA,25.3,69,65,13.4,63,61,12.4,62,59,12.1,18.95,65,62,12.7,67,63,13,NA,NA,NA,NA,68,63,13.1,19.4,63.65,0,63.65,4,2015,7,12,7/2/2015,10
236,Percussion on the Pearl,"Muscatine, IA",Muscatine,IA,7/12/2015,Pioneer,58,54,11.2,58,56,11.4,NA,NA,NA,NA,NA,NA,NA,NA,22.6,57,50,10.7,56,53,10.9,60,54,11.4,16.5,56,54,11,63,60,12.3,NA,NA,NA,NA,63,59,12.2,17.75,56.85,0,56.85,5,2015,7,12,6/23/2015,19
237,Tour of Champions - Central Missouri,"Warrensburg, MO",Warrensburg,MO,7/13/2015,The Cadets,85,84,16.9,87,84,17.1,NA,NA,NA,NA,NA,NA,NA,NA,34,87,86,17.3,88,86,17.4,83,80,16.3,25.5,85,79,16.4,87,85,17.2,NA,NA,NA,NA,89,84,17.3,25.45,84.95,0,84.95,1,2015,7,13,6/17/2015,26
238,Tour of Champions - Central Missouri,"Warrensburg, MO",Warrensburg,MO,7/13/2015,Blue Devils,86,84,17,86,82,16.8,NA,NA,NA,NA,NA,NA,NA,NA,33.8,86,85,17.1,86,84,17,87,85,17.2,25.65,84,82,16.6,86,83,16.9,NA,NA,NA,NA,87,82,16.9,25.2,84.65,0,84.65,2,2015,7,13,6/19/2015,24
239,Tour of Champions - Central Missouri,"Warrensburg, MO",Warrensburg,MO,7/13/2015,Bluecoats,85,82,16.7,84,81,16.5,NA,NA,NA,NA,NA,NA,NA,NA,33.2,84,83,16.7,85,83,16.8,86,84,17,25.25,83,80,16.3,83,82,16.5,NA,NA,NA,NA,86,86,17.2,25,83.45,0,83.45,3,2015,7,13,6/17/2015,26
240,Tour of Champions - Central Missouri,"Warrensburg, MO",Warrensburg,MO,7/13/2015,Carolina Crown,83,82,16.5,84,80,16.4,NA,NA,NA,NA,NA,NA,NA,NA,32.9,85,81,16.6,84,82,16.6,85,83,16.8,25,85,80,16.5,86,81,16.7,NA,NA,NA,NA,84,81,16.5,24.85,82.75,0,82.75,4,2015,7,13,6/17/2015,26
241,Tour of Champions - Central Missouri,"Warrensburg, MO",Warrensburg,MO,7/13/2015,Santa Clara Vanguard,83,83,16.6,83,79,16.2,NA,NA,NA,NA,NA,NA,NA,NA,32.8,83,82,16.5,87,85,17.2,84,82,16.6,25.15,81,80,16.1,82,82,16.4,NA,NA,NA,NA,88,83,17.1,24.8,82.75,0,82.75,4,2015,7,13,6/19/2015,24
242,Tour of Champions - Central Missouri,"Warrensburg, MO",Warrensburg,MO,7/13/2015,The Cavaliers,79,78,15.7,80,76,15.6,NA,NA,NA,NA,NA,NA,NA,NA,31.3,81,77,15.8,83,80,16.3,82,76,15.8,23.95,79,75,15.4,81,80,16.1,NA,NA,NA,NA,83,80,16.3,23.9,79.15,0,79.15,6,2015,7,13,6/17/2015,26
243,Tour of Champions - Central Missouri,"Warrensburg, MO",Warrensburg,MO,7/13/2015,Phantom Regiment,77,75,15.2,78,75,15.3,NA,NA,NA,NA,NA,NA,NA,NA,30.5,79,76,15.5,81,78,15.9,81,79,16,23.7,80,77,15.7,79,79,15.8,NA,NA,NA,NA,79,76,15.5,23.5,77.7,0,77.7,7,2015,7,13,6/19/2015,24
244,Drums Across Nebraska,"Freemont, NE",Freemont,NE,7/13/2015,Blue Knights,83,81,16.4,83,80,16.3,NA,NA,NA,NA,NA,NA,NA,NA,32.7,81,79,16,82,79,16.1,83,82,16.5,24.3,82,78,16,79,76,15.5,NA,NA,NA,NA,83,80,16.3,23.9,80.9,0,80.9,1,2015,7,13,6/19/2015,24
245,Drums Across Nebraska,"Freemont, NE",Freemont,NE,7/13/2015,Troopers,77,74,15.1,78,76,15.4,NA,NA,NA,NA,NA,NA,NA,NA,30.5,73,71,14.4,77,75,15.2,77,76,15.3,22.45,77,73,15,76,73,14.9,NA,NA,NA,NA,77,76,15.3,22.6,75.55,0,75.55,2,2015,7,13,6/19/2015,24
246,Drums Across Nebraska,"Freemont, NE",Freemont,NE,7/13/2015,The Academy,76,76,15.2,75,75,15,NA,NA,NA,NA,NA,NA,NA,NA,30.2,74,73,14.7,74,72,14.6,75,74,14.9,22.1,74,71,14.5,74,69,14.3,NA,NA,NA,NA,76,75,15.1,21.95,74.25,0,74.25,3,2015,7,13,6/27/2015,16
247,Drums Across Nebraska,"Freemont, NE",Freemont,NE,7/13/2015,Spirit of Atlanta,73,70,14.3,72,70,14.2,NA,NA,NA,NA,NA,NA,NA,NA,28.5,70,65,13.5,72,68,14,73,70,14.3,20.9,73,70,14.3,71,66,13.7,NA,NA,NA,NA,74,72,14.6,21.3,70.7,0,70.7,4,2015,7,13,6/20/2015,23
248,Drums Across Nebraska,"Freemont, NE",Freemont,NE,7/13/2015,Pacific Crest,74,71,14.5,73,71,14.4,NA,NA,NA,NA,NA,NA,NA,NA,28.9,70,69,13.9,69,66,13.5,68,68,13.6,20.5,72,68,14,72,67,13.9,NA,NA,NA,NA,71,70,14.1,21,70.4,0,70.4,5,2015,7,13,6/19/2015,24
249,Drums Across Nebraska,"Freemont, NE",Freemont,NE,7/13/2015,Mandarins,71,69,14,72,70,14.2,NA,NA,NA,NA,NA,NA,NA,NA,28.2,71,66,13.7,70,67,13.7,72,67,13.9,20.65,70,67,13.7,66,68,13.4,NA,NA,NA,NA,69,68,13.7,20.4,69.25,0,69.25,6,2015,7,13,6/19/2015,24
250,Music on the Move,"Bentonville, AR",Bentonville,AR,7/14/2015,Blue Devils,87,84,17.1,86,85,17.1,NA,NA,NA,NA,NA,NA,NA,NA,34.2,87,86,17.3,87,87,17.4,86,86,17.2,25.95,84,83,16.7,86,83,16.9,NA,NA,NA,NA,87,84,17.1,25.35,85.5,0,85.5,1,2015,7,14,6/19/2015,25
251,Music on the Move,"Bentonville, AR",Bentonville,AR,7/14/2015,Carolina Crown,85,82,16.7,84,84,16.8,NA,NA,NA,NA,NA,NA,NA,NA,33.5,86,84,17,86,85,17.1,85,85,17,25.55,85,81,16.6,87,84,17.1,NA,NA,NA,NA,84,83,16.7,25.2,84.25,0,84.25,2,2015,7,14,6/17/2015,27
252,Music on the Move,"Bentonville, AR",Bentonville,AR,7/14/2015,Boston Crusaders,78,75,15.3,75,74,14.9,NA,NA,NA,NA,NA,NA,NA,NA,30.2,80,76,15.6,77,76,15.3,80,78,15.8,23.35,76,72,14.8,78,74,15.2,NA,NA,NA,NA,79,78,15.7,22.85,76.4,0,76.4,3,2015,7,14,6/20/2015,24
253,Music on the Move,"Bentonville, AR",Bentonville,AR,7/14/2015,Colts,75,73,14.8,76,72,14.8,NA,NA,NA,NA,NA,NA,NA,NA,29.6,77,74,15.1,73,69,14.2,70,70,14,21.65,72,68,14,75,70,14.5,NA,NA,NA,NA,73,71,14.4,21.45,72.7,0,72.7,4,2015,7,14,6/20/2015,24
254,Music on the Move,"Bentonville, AR",Bentonville,AR,7/14/2015,Spirit of Atlanta,73,71,14.4,73,70,14.3,NA,NA,NA,NA,NA,NA,NA,NA,28.7,75,71,14.6,72,71,14.3,72,67,13.9,21.4,73,69,14.2,76,71,14.7,NA,NA,NA,NA,75,72,14.7,21.8,71.9,0,71.9,5,2015,7,14,6/20/2015,24
255,Music on the Move,"Bentonville, AR",Bentonville,AR,7/14/2015,Jersey Surf,64,61,12.5,70,68,13.8,NA,NA,NA,NA,NA,NA,NA,NA,26.3,67,63,13,63,60,12.3,58,53,11.1,18.2,61,58,11.9,68,60,12.8,NA,NA,NA,NA,68,66,13.4,19.05,63.55,0,63.55,6,2015,7,14,7/2/2015,12
256,Music on the Move,"Bentonville, AR",Bentonville,AR,7/14/2015,Pioneer,60,55,11.5,61,63,12.4,NA,NA,NA,NA,NA,NA,NA,NA,23.9,62,57,11.9,57,52,10.9,61,55,11.6,17.2,55,52,10.7,66,57,12.3,NA,NA,NA,NA,62,60,12.2,17.6,58.7,0,58.7,7,2015,7,14,6/23/2015,21
257,March of Champions,"Great Bend, KS",Great Bend,KS,7/14/2015,Blue Knights,86,82,16.8,82,80,16.2,NA,NA,NA,NA,NA,NA,NA,NA,33,83,81,16.4,83,79,16.2,84,83,16.7,24.65,82,80,16.2,81,79,16,NA,NA,NA,NA,83,82,16.5,24.35,82,0,82,1,2015,7,14,6/19/2015,25
258,March of Champions,"Great Bend, KS",Great Bend,KS,7/14/2015,Blue Stars,78,75,15.3,77,77,15.4,NA,NA,NA,NA,NA,NA,NA,NA,30.7,76,72,14.8,79,76,15.5,81,78,15.9,23.1,74,74,14.8,76,73,14.9,NA,NA,NA,NA,80,80,16,22.85,76.65,0,76.65,2,2015,7,14,6/17/2015,27
259,March of Champions,"Great Bend, KS",Great Bend,KS,7/14/2015,Crossmen,81,75,15.6,75,74,14.9,NA,NA,NA,NA,NA,NA,NA,NA,30.5,80,78,15.8,77,77,15.4,80,79,15.9,23.55,76,75,15.1,73,71,14.4,NA,NA,NA,NA,76,76,15.2,22.35,76.4,0,76.4,3,2015,7,14,6/19/2015,25
260,March of Champions,"Great Bend, KS",Great Bend,KS,7/14/2015,Troopers,79,76,15.5,78,75,15.3,NA,NA,NA,NA,NA,NA,NA,NA,30.8,78,74,15.2,76,75,15.1,79,77,15.6,22.95,77,73,15,77,74,15.1,NA,NA,NA,NA,74,73,14.7,22.4,76.15,0,76.15,4,2015,7,14,6/19/2015,25
261,March of Champions,"Great Bend, KS",Great Bend,KS,7/14/2015,The Academy,80,78,15.8,76,72,14.8,NA,NA,NA,NA,NA,NA,NA,NA,30.6,75,71,14.6,74,72,14.6,77,76,15.3,22.25,75,72,14.7,74,72,14.6,NA,NA,NA,NA,76,72,14.8,22.05,74.9,0,74.9,5,2015,7,14,6/27/2015,17
262,March of Champions,"Great Bend, KS",Great Bend,KS,7/14/2015,Oregon Crusaders,70,67,13.7,72,69,14.1,NA,NA,NA,NA,NA,NA,NA,NA,27.8,71,68,13.9,68,64,13.2,72,68,14,20.55,73,71,14.4,71,69,14,NA,NA,NA,NA,73,71,14.4,21.4,69.75,0,69.75,6,2015,7,14,7/2/2015,12
263,DCI in the Heartland,"Mustang, OK",Mustang,OK,7/15/2015,The Cadets,88,86,17.4,87,86,17.3,NA,NA,NA,NA,NA,NA,NA,NA,34.7,89,88,17.7,86,87,17.3,84,83,16.7,25.85,86,82,16.8,88,85,17.3,NA,NA,NA,NA,89,88,17.7,25.9,86.45,0,86.45,1,2015,7,15,6/17/2015,28
264,DCI in the Heartland,"Mustang, OK",Mustang,OK,7/15/2015,Blue Knights,85,83,16.8,84,83,16.7,NA,NA,NA,NA,NA,NA,NA,NA,33.5,84,83,16.7,83,81,16.4,82,81,16.3,24.7,82,80,16.2,83,82,16.5,NA,NA,NA,NA,87,86,17.3,25,83.2,0,83.2,2,2015,7,15,6/19/2015,26
265,DCI in the Heartland,"Mustang, OK",Mustang,OK,7/15/2015,Madison Scouts,80,78,15.8,79,78,15.7,NA,NA,NA,NA,NA,NA,NA,NA,31.5,79,77,15.6,78,77,15.5,75,76,15.1,23.1,80,75,15.5,80,77,15.7,NA,NA,NA,NA,85,84,16.9,24.05,78.65,0,78.65,3,2015,7,15,6/17/2015,28
266,DCI in the Heartland,"Mustang, OK",Mustang,OK,7/15/2015,Troopers,79,77,15.6,78,77,15.5,NA,NA,NA,NA,NA,NA,NA,NA,31.1,77,73,15,75,74,14.9,73,71,14.4,22.15,76,73,14.9,77,75,15.2,NA,NA,NA,NA,83,80,16.3,23.2,76.45,0,76.45,4,2015,7,15,6/19/2015,26
267,DCI in the Heartland,"Mustang, OK",Mustang,OK,7/15/2015,Colts,75,73,14.8,73,72,14.5,NA,NA,NA,NA,NA,NA,NA,NA,29.3,73,70,14.3,76,72,14.8,72,70,14.2,21.65,72,68,14,75,72,14.7,NA,NA,NA,NA,74,71,14.5,21.6,72.55,0,72.55,5,2015,7,15,6/20/2015,25
268,DCI in the Heartland,"Mustang, OK",Mustang,OK,7/15/2015,Pacific Crest,76,73,14.9,76,74,15,NA,NA,NA,NA,NA,NA,NA,NA,29.9,74,71,14.5,72,70,14.2,69,67,13.6,21.15,74,71,14.5,69,67,13.6,NA,NA,NA,NA,71,67,13.8,20.95,72,0,72,6,2015,7,15,6/19/2015,26
269,DCI in the Heartland,"Mustang, OK",Mustang,OK,7/15/2015,Mandarins,73,71,14.4,74,73,14.7,NA,NA,NA,NA,NA,NA,NA,NA,29.1,75,72,14.7,71,69,14,68,65,13.3,21,72,70,14.2,70,68,13.8,NA,NA,NA,NA,75,72,14.7,21.35,71.45,0,71.45,7,2015,7,15,6/19/2015,26
270,DCI in the Heartland,"Mustang, OK",Mustang,OK,7/15/2015,Pioneer,61,55,11.6,61,56,11.7,NA,NA,NA,NA,NA,NA,NA,NA,23.3,62,59,12.1,59,55,11.4,62,58,12,17.75,60,57,11.7,63,58,12.1,NA,NA,NA,NA,68,64,13.2,18.5,59.55,0,59.55,9,2015,7,15,6/23/2015,22
271,DCI Central Texas,"Belton, TX",Belton,TX,7/16/2015,Blue Knights,84,84,16.8,87,84,17.1,NA,NA,NA,NA,NA,NA,NA,NA,33.9,84,81,16.5,82,78,16,82,80,16.2,24.35,83,81,16.4,83,82,16.5,NA,NA,NA,NA,89,85,17.4,25.15,83.4,0,83.4,1,2015,7,16,6/19/2015,27
272,DCI Central Texas,"Belton, TX",Belton,TX,7/16/2015,Phantom Regiment,77,74,15.1,86,86,17.2,NA,NA,NA,NA,NA,NA,NA,NA,32.3,81,78,15.9,77,74,15.1,81,79,16,23.5,82,80,16.2,84,83,16.7,NA,NA,NA,NA,84,82,16.6,24.75,80.55,0,80.55,2,2015,7,16,6/19/2015,27
273,DCI Central Texas,"Belton, TX",Belton,TX,7/16/2015,Madison Scouts,81,83,16.4,84,79,16.3,NA,NA,NA,NA,NA,NA,NA,NA,32.7,74,73,14.7,78,76,15.4,76,75,15.1,22.6,77,75,15.2,81,80,16.1,NA,NA,NA,NA,85,83,16.8,24.05,79.35,0,79.35,3,2015,7,16,6/17/2015,29
274,DCI Central Texas,"Belton, TX",Belton,TX,7/16/2015,Crossmen,79,79,15.8,81,80,16.1,NA,NA,NA,NA,NA,NA,NA,NA,31.9,76,74,15,80,77,15.7,79,77,15.6,23.15,78,76,15.4,75,72,14.7,NA,NA,NA,NA,86,84,17,23.55,78.6,0,78.6,4,2015,7,16,6/19/2015,27
275,DCI Central Texas,"Belton, TX",Belton,TX,7/16/2015,Boston Crusaders,76,76,15.2,85,81,16.6,NA,NA,NA,NA,NA,NA,NA,NA,31.8,79,75,15.4,79,73,15.2,80,78,15.8,23.2,75,71,14.6,82,81,16.3,NA,NA,NA,NA,79,75,15.4,23.15,78.15,0,78.15,5,2015,7,16,6/20/2015,26
276,DCI Central Texas,"Belton, TX",Belton,TX,7/16/2015,Blue Stars,75,73,14.8,82,78,16,NA,NA,NA,NA,NA,NA,NA,NA,30.8,78,77,15.5,76,72,14.8,77,76,15.3,22.8,76,74,15,78,76,15.4,NA,NA,NA,NA,83,81,16.4,23.4,77,0,77,6,2015,7,16,6/17/2015,29
277,DCI Central Texas,"Belton, TX",Belton,TX,7/16/2015,The Academy,82,81,16.3,79,76,15.5,NA,NA,NA,NA,NA,NA,NA,NA,31.8,72,72,14.4,75,74,14.9,75,72,14.7,22,72,72,14.4,76,74,15,NA,NA,NA,NA,81,77,15.8,22.6,76.4,0,76.4,7,2015,7,16,6/27/2015,19
278,DCI Central Texas,"Belton, TX",Belton,TX,7/16/2015,Troopers,78,77,15.5,80,77,15.7,NA,NA,NA,NA,NA,NA,NA,NA,31.2,75,71,14.6,74,72,14.6,73,71,14.4,21.8,74,73,14.7,77,75,15.2,NA,NA,NA,NA,83,81,16.4,23.15,76.15,0,76.15,8,2015,7,16,6/19/2015,27
279,DCI Central Texas,"Belton, TX",Belton,TX,7/16/2015,Pacific Crest,72,71,14.3,77,74,15.1,NA,NA,NA,NA,NA,NA,NA,NA,29.4,68,66,13.4,73,71,14.4,72,69,14.1,20.95,73,70,14.3,70,69,13.9,NA,NA,NA,NA,72,69,14.1,21.15,71.5,0,71.5,9,2015,7,16,6/19/2015,27
280,DCI Central Texas,"Belton, TX",Belton,TX,7/16/2015,Mandarins,73,69,14.2,75,73,14.8,NA,NA,NA,NA,NA,NA,NA,NA,29,69,63,13.2,70,68,13.8,67,64,13.1,20.05,70,69,13.9,72,70,14.2,NA,NA,NA,NA,74,70,14.4,21.25,70.3,0,70.3,10,2015,7,16,6/19/2015,27
281,DCI Central Texas,"Belton, TX",Belton,TX,7/16/2015,Pioneer,62,57,11.9,60,57,11.7,NA,NA,NA,NA,NA,NA,NA,NA,23.6,61,57,11.8,64,62,12.6,65,63,12.8,18.6,58,57,11.5,60,56,11.6,NA,NA,NA,NA,66,65,13.1,18.1,60.3,0,60.3,11,2015,7,16,6/23/2015,23
282,DCI Denton,"Denton, TX",Denton,TX,7/16/2015,The Cadets,88,87,17.5,87,85,17.2,NA,NA,NA,NA,NA,NA,NA,NA,34.7,87,83,17,89,82,17.1,83,83,16.6,25.35,87,85,17.2,87,85,17.2,NA,NA,NA,NA,86,87,17.3,25.85,85.9,0,85.9,1,2015,7,16,6/17/2015,29
283,DCI Denton,"Denton, TX",Denton,TX,7/16/2015,Bluecoats,89,84,17.3,86,84,17,NA,NA,NA,NA,NA,NA,NA,NA,34.3,86,82,16.8,85,82,16.7,86,85,17.1,25.3,85,83,16.8,85,84,16.9,NA,NA,NA,NA,87,87,17.4,25.55,85.15,0,85.15,2,2015,7,16,6/17/2015,29
284,DCI Denton,"Denton, TX",Denton,TX,7/16/2015,Carolina Crown,85,85,17,85,84,16.9,NA,NA,NA,NA,NA,NA,NA,NA,33.9,85,80,16.5,88,85,17.3,87,86,17.3,25.55,86,84,17,83,83,16.6,NA,NA,NA,NA,85,83,16.8,25.2,84.65,0,84.65,3,2015,7,16,6/17/2015,29
285,DCI Denton,"Denton, TX",Denton,TX,7/16/2015,Santa Clara Vanguard,86,83,16.9,84,83,16.7,NA,NA,NA,NA,NA,NA,NA,NA,33.6,83,83,16.6,87,83,17,85,84,16.9,25.25,83,82,16.5,82,82,16.4,NA,NA,NA,NA,87,88,17.5,25.2,84.05,0,84.05,4,2015,7,16,6/19/2015,27
286,DCI Denton,"Denton, TX",Denton,TX,7/16/2015,The Cavaliers,83,78,16.1,81,80,16.1,NA,NA,NA,NA,NA,NA,NA,NA,32.2,80,79,15.9,82,78,16,81,78,15.9,23.9,80,77,15.7,81,79,16,NA,NA,NA,NA,84,82,16.6,24.15,80.25,0,80.25,5,2015,7,16,6/17/2015,29
287,DCI Denton,"Denton, TX",Denton,TX,7/16/2015,Colts,76,73,14.9,75,72,14.7,NA,NA,NA,NA,NA,NA,NA,NA,29.6,77,73,15,76,74,15,75,73,14.8,22.4,71,72,14.3,76,73,14.9,NA,NA,NA,NA,71,80,15.1,22.15,74.15,0,74.15,6,2015,7,16,6/20/2015,26
288,DCI Denton,"Denton, TX",Denton,TX,7/16/2015,Spirit of Atlanta,74,72,14.6,72,70,14.2,NA,NA,NA,NA,NA,NA,NA,NA,28.8,76,75,15.1,77,71,14.8,73,70,14.3,22.1,73,71,14.4,74,72,14.6,NA,NA,NA,NA,72,70,14.2,21.6,72.5,0,72.5,7,2015,7,16,6/20/2015,26
289,DCI Denton,"Denton, TX",Denton,TX,7/16/2015,Oregon Crusaders,71,68,13.9,70,68,13.8,NA,NA,NA,NA,NA,NA,NA,NA,27.7,70,67,13.7,69,65,13.4,70,68,13.8,20.45,74,72,14.6,73,71,14.4,NA,NA,NA,NA,75,69,14.4,21.7,69.85,0,69.85,8,2015,7,16,7/2/2015,14
290,DCI Denton,"Denton, TX",Denton,TX,7/16/2015,Jersey Surf,65,63,12.8,65,62,12.7,NA,NA,NA,NA,NA,NA,NA,NA,25.5,68,66,13.4,63,59,12.2,65,61,12.6,19.1,66,65,13.1,65,63,12.8,NA,NA,NA,NA,53,48,10.1,18,62.6,0,62.6,10,2015,7,16,7/2/2015,14
291,DCI Central Texas,"Belton, TX",Belton,TX,7/16/2015,Blue Knights,84,84,16.8,87,84,17.1,NA,NA,NA,NA,NA,NA,NA,NA,33.9,84,81,16.5,82,78,16,82,80,16.2,24.35,83,81,16.4,83,82,16.5,NA,NA,NA,NA,89,85,17.4,25.15,83.4,0,83.4,1,2015,7,16,6/19/2015,27
292,DCI Central Texas,"Belton, TX",Belton,TX,7/16/2015,Phantom Regiment,77,74,15.1,86,86,17.2,NA,NA,NA,NA,NA,NA,NA,NA,32.3,81,78,15.9,77,74,15.1,81,79,16,23.5,82,80,16.2,84,83,16.7,NA,NA,NA,NA,84,82,16.6,24.75,80.55,0,80.55,2,2015,7,16,6/19/2015,27
293,DCI Central Texas,"Belton, TX",Belton,TX,7/16/2015,Madison Scouts,81,83,16.4,84,79,16.3,NA,NA,NA,NA,NA,NA,NA,NA,32.7,74,73,14.7,78,76,15.4,76,75,15.1,22.6,77,75,15.2,81,80,16.1,NA,NA,NA,NA,85,83,16.8,24.05,79.35,0,79.35,3,2015,7,16,6/17/2015,29
294,DCI Central Texas,"Belton, TX",Belton,TX,7/16/2015,Crossmen,79,79,15.8,81,80,16.1,NA,NA,NA,NA,NA,NA,NA,NA,31.9,76,74,15,80,77,15.7,79,77,15.6,23.15,78,76,15.4,75,72,14.7,NA,NA,NA,NA,86,84,17,23.55,78.6,0,78.6,4,2015,7,16,6/19/2015,27
295,DCI Central Texas,"Belton, TX",Belton,TX,7/16/2015,Boston Crusaders,76,76,15.2,85,81,16.6,NA,NA,NA,NA,NA,NA,NA,NA,31.8,79,75,15.4,79,73,15.2,80,78,15.8,23.2,75,71,14.6,82,81,16.3,NA,NA,NA,NA,79,75,15.4,23.15,78.15,0,78.15,5,2015,7,16,6/20/2015,26
296,DCI Central Texas,"Belton, TX",Belton,TX,7/16/2015,Blue Stars,75,73,14.8,82,78,16,NA,NA,NA,NA,NA,NA,NA,NA,30.8,78,77,15.5,76,72,14.8,77,76,15.3,22.8,76,74,15,78,76,15.4,NA,NA,NA,NA,83,81,16.4,23.4,77,0,77,6,2015,7,16,6/17/2015,29
297,DCI Central Texas,"Belton, TX",Belton,TX,7/16/2015,The Academy,82,81,16.3,79,76,15.5,NA,NA,NA,NA,NA,NA,NA,NA,31.8,72,72,14.4,75,74,14.9,75,72,14.7,22,72,72,14.4,76,74,15,NA,NA,NA,NA,81,77,15.8,22.6,76.4,0,76.4,7,2015,7,16,6/27/2015,19
298,DCI Central Texas,"Belton, TX",Belton,TX,7/16/2015,Troopers,78,77,15.5,80,77,15.7,NA,NA,NA,NA,NA,NA,NA,NA,31.2,75,71,14.6,74,72,14.6,73,71,14.4,21.8,74,73,14.7,77,75,15.2,NA,NA,NA,NA,83,81,16.4,23.15,76.15,0,76.15,8,2015,7,16,6/19/2015,27
299,DCI Central Texas,"Belton, TX",Belton,TX,7/16/2015,Pacific Crest,72,71,14.3,77,74,15.1,NA,NA,NA,NA,NA,NA,NA,NA,29.4,68,66,13.4,73,71,14.4,72,69,14.1,20.95,73,70,14.3,70,69,13.9,NA,NA,NA,NA,72,69,14.1,21.15,71.5,0,71.5,9,2015,7,16,6/19/2015,27
300,DCI Central Texas,"Belton, TX",Belton,TX,7/16/2015,Mandarins,73,69,14.2,75,73,14.8,NA,NA,NA,NA,NA,NA,NA,NA,29,69,63,13.2,70,68,13.8,67,64,13.1,20.05,70,69,13.9,72,70,14.2,NA,NA,NA,NA,74,70,14.4,21.25,70.3,0,70.3,10,2015,7,16,6/19/2015,27
301,DCI Central Texas,"Belton, TX",Belton,TX,7/16/2015,Pioneer,62,57,11.9,60,57,11.7,NA,NA,NA,NA,NA,NA,NA,NA,23.6,61,57,11.8,64,62,12.6,65,63,12.8,18.6,58,57,11.5,60,56,11.6,NA,NA,NA,NA,66,65,13.1,18.1,60.3,0,60.3,11,2015,7,16,6/23/2015,23
302,DCI Southwestern Championship,"San Antonio, TX",San Antonio,TX,7/18/2015,The Cadets,88,89,17.7,89,89,17.8,17.75,86,89,17.5,91,89,18,17.75,35.5,89,88,17.7,87,85,17.2,84,85,16.9,25.9,88,87,17.5,88,88,17.6,85,84,16.9,90,88,17.8,17.35,26.225,87.625,0,87.625,1,2015,7,18,6/17/2015,31
303,DCI Southwestern Championship,"San Antonio, TX",San Antonio,TX,7/18/2015,Blue Devils,89,86,17.5,90,87,17.7,17.6,85,89,17.4,88,88,17.6,17.5,35.1,90,89,17.9,88,88,17.6,88,86,17.4,26.45,87,86,17.3,86,86,17.2,83,81,16.4,89,87,17.6,17,25.75,87.3,0,87.3,2,2015,7,18,6/19/2015,29
304,DCI Southwestern Championship,"San Antonio, TX",San Antonio,TX,7/18/2015,Carolina Crown,85,87,17.2,88,87,17.5,17.35,85,88,17.3,86,86,17.2,17.25,34.6,88,84,17.2,85,84,16.9,87,88,17.5,25.8,89,85,17.4,87,87,17.4,83,82,16.5,87,84,17.1,16.8,25.8,86.2,0,86.2,3,2015,7,18,6/17/2015,31
305,DCI Southwestern Championship,"San Antonio, TX",San Antonio,TX,7/18/2015,Bluecoats,87,87,17.4,86,85,17.1,17.25,86,85,17.1,90,87,17.7,17.4,34.65,86,82,16.8,86,87,17.3,86,84,17,25.55,85,84,16.9,85,85,17,82,85,16.7,86,86,17.2,16.95,25.425,85.625,0,85.625,4,2015,7,18,6/17/2015,31
306,DCI Southwestern Championship,"San Antonio, TX",San Antonio,TX,7/18/2015,Santa Clara Vanguard,86,85,17.1,87,86,17.3,17.2,83,85,16.8,87,83,17,16.9,34.1,87,86,17.3,84,83,16.7,85,83,16.8,25.4,84,82,16.6,84,84,16.8,85,86,17.1,88,86,17.4,17.25,25.325,84.825,0,84.825,5,2015,7,18,6/19/2015,29
307,DCI Southwestern Championship,"San Antonio, TX",San Antonio,TX,7/18/2015,Blue Knights,84,83,16.7,85,84,16.9,16.8,82,82,16.4,84,84,16.8,16.6,33.4,82,81,16.3,79,78,15.7,80,79,15.9,23.95,82,80,16.2,83,82,16.5,81,80,16.1,84,83,16.7,16.4,24.55,81.9,0,81.9,6,2015,7,18,6/19/2015,29
308,DCI Southwestern Championship,"San Antonio, TX",San Antonio,TX,7/18/2015,The Cavaliers,81,81,16.2,85,83,16.8,16.5,83,82,16.5,85,81,16.6,16.55,33.05,83,79,16.2,82,78,16,82,82,16.4,24.3,83,81,16.4,82,81,16.3,80,77,15.7,85,83,16.8,16.25,24.475,81.825,0,81.825,7,2015,7,18,6/17/2015,31
309,DCI Southwestern Championship,"San Antonio, TX",San Antonio,TX,7/18/2015,Phantom Regiment,82,82,16.4,84,82,16.6,16.5,82,84,16.6,83,82,16.5,16.55,33.05,81,77,15.8,81,81,16.2,83,80,16.3,24.15,81,79,16,81,80,16.1,74,73,14.7,83,79,16.2,15.45,23.775,80.975,0,80.975,8,2015,7,18,6/19/2015,29
310,DCI Southwestern Championship,"San Antonio, TX",San Antonio,TX,7/18/2015,Madison Scouts,80,80,16,82,82,16.4,16.2,81,81,16.2,82,80,16.2,16.2,32.4,79,77,15.6,78,80,15.8,75,77,15.2,23.3,80,78,15.8,79,77,15.6,75,73,14.8,82,82,16.4,15.6,23.5,79.2,0,79.2,9,2015,7,18,6/17/2015,31
311,DCI Southwestern Championship,"San Antonio, TX",San Antonio,TX,7/18/2015,Boston Crusaders,79,78,15.7,84,81,16.5,16.1,76,74,15,79,76,15.5,15.25,31.35,82,78,16,77,75,15.2,79,79,15.8,23.5,77,73,15,77,75,15.2,76,74,15,81,80,16.1,15.55,22.875,77.725,0,77.725,10,2015,7,18,6/20/2015,28
312,DCI Southwestern Championship,"San Antonio, TX",San Antonio,TX,7/18/2015,Crossmen,77,77,15.4,83,80,16.3,15.85,76,78,15.4,77,75,15.2,15.3,31.15,80,79,15.9,80,79,15.9,78,75,15.3,23.55,76,75,15.1,78,76,15.4,72,68,14,80,79,15.9,14.95,22.725,77.425,0,77.425,11,2015,7,18,6/19/2015,29
313,DCI Southwestern Championship,"San Antonio, TX",San Antonio,TX,7/18/2015,Blue Stars,76,74,15,80,78,15.8,15.4,75,77,15.2,81,77,15.8,15.5,30.9,76,73,14.9,75,73,14.8,81,76,15.7,22.7,79,77,15.6,80,78,15.8,75,76,15.1,82,81,16.3,15.7,23.55,77.15,0,77.15,12,2015,7,18,6/17/2015,31
314,DCI Southwestern Championship,"San Antonio, TX",San Antonio,TX,7/18/2015,Troopers,78,77,15.5,81,79,16,15.75,80,80,16,76,74,15,15.5,31.25,77,74,15.1,74,72,14.6,75,72,14.7,22.2,78,76,15.4,77,76,15.3,73,72,14.5,78,76,15.4,14.95,22.825,76.275,0,76.275,13,2015,7,18,6/19/2015,29
315,DCI Southwestern Championship,"San Antonio, TX",San Antonio,TX,7/18/2015,Colts,78,75,15.3,79,77,15.6,15.45,72,75,14.7,74,72,14.6,14.65,30.1,78,74,15.2,78,75,15.3,76,74,15,22.75,74,74,14.8,76,74,15,72,74,14.6,79,74,15.3,14.95,22.375,75.225,0,75.225,14,2015,7,18,6/20/2015,28
316,DCI Southwestern Championship,"San Antonio, TX",San Antonio,TX,7/18/2015,The Academy,75,76,15.1,78,76,15.4,15.25,71,71,14.2,76,71,14.7,14.45,29.7,77,76,15.3,76,74,15,74,75,14.9,22.6,73,70,14.3,75,72,14.7,72,69,14.1,76,74,15,14.55,21.775,74.075,0,74.075,15,2015,7,18,6/27/2015,21
317,DCI Southwestern Championship,"San Antonio, TX",San Antonio,TX,7/18/2015,Spirit of Atlanta,74,70,14.4,75,73,14.8,14.6,72,72,14.4,75,73,14.8,14.6,29.2,74,68,14.2,71,70,14.1,73,69,14.2,21.25,74,72,14.6,74,71,14.5,67,66,13.3,71,68,13.9,13.6,21.35,71.8,0,71.8,16,2015,7,18,6/20/2015,28
318,DCI Southwestern Championship,"San Antonio, TX",San Antonio,TX,7/18/2015,Mandarins,70,71,14.1,72,70,14.2,14.15,73,73,14.6,73,67,14,14.3,28.45,70,65,13.5,68,67,13.5,68,66,13.4,20.2,72,66,13.8,68,67,13.5,73,70,14.3,73,71,14.4,14.35,20.825,69.475,0,69.475,17,2015,7,18,6/19/2015,29
319,DCI Southwestern Championship,"San Antonio, TX",San Antonio,TX,7/18/2015,Oregon Crusaders,69,68,13.7,68,66,13.4,13.55,66,69,13.5,72,70,14.2,13.85,27.4,73,71,14.4,67,64,13.1,71,68,13.9,20.7,73,71,14.4,72,70,14.2,74,68,14.2,72,69,14.1,14.15,21.375,69.475,0,69.475,17,2015,7,18,7/2/2015,16
320,DCI Southwestern Championship,"San Antonio, TX",San Antonio,TX,7/18/2015,Pacific Crest,64,63,12.7,70,67,13.7,13.2,63,64,12.7,71,68,13.9,13.3,26.5,71,69,14,69,68,13.7,70,67,13.7,20.7,71,70,14.1,69,64,13.3,64,63,12.7,69,66,13.5,13.1,20.25,67.45,0,67.45,19,2015,7,18,6/19/2015,29
321,DCI Southwestern Championship,"San Antonio, TX",San Antonio,TX,7/18/2015,Jersey Surf,61,62,12.3,65,61,12.6,12.45,65,66,13.1,64,64,12.8,12.95,25.4,67,63,13,66,62,12.8,64,60,12.4,19.1,69,68,13.7,65,63,12.8,58,57,11.5,61,56,11.7,11.6,19.05,63.55,0,63.55,21,2015,7,18,7/2/2015,16
322,DCI Southwestern Championship,"San Antonio, TX",San Antonio,TX,7/18/2015,Pioneer,62,58,12,62,59,12.1,12.05,61,60,12.1,61,58,11.9,12,24.05,61,59,12,64,61,12.5,62,59,12.1,18.3,63,57,12,59,58,11.7,56,52,10.8,58,57,11.5,11.15,17.425,59.775,2,57.775,22,2015,7,18,6/23/2015,25
323,DCI Dallas,"Dallas, TX",Dallas,TX,7/20/2015,Blue Devils,90,88,17.8,89,87,17.6,NA,NA,NA,NA,NA,NA,NA,NA,35.4,90,88,17.8,89,88,17.7,90,88,17.8,26.65,86,84,17,89,87,17.6,NA,NA,NA,NA,87,84,17.1,25.85,87.9,0,87.9,1,2015,7,20,6/19/2015,31
324,DCI Dallas,"Dallas, TX",Dallas,TX,7/20/2015,Santa Clara Vanguard,87,85,17.2,86,85,17.1,NA,NA,NA,NA,NA,NA,NA,NA,34.3,88,85,17.3,87,85,17.2,87,86,17.3,25.9,85,83,16.8,87,85,17.2,NA,NA,NA,NA,88,86,17.4,25.7,85.9,0,85.9,2,2015,7,20,6/19/2015,31
325,DCI Dallas,"Dallas, TX",Dallas,TX,7/20/2015,Blue Knights,85,83,16.8,84,83,16.7,NA,NA,NA,NA,NA,NA,NA,NA,33.5,84,81,16.5,80,80,16,81,81,16.2,24.35,82,81,16.3,85,84,16.9,NA,NA,NA,NA,83,82,16.5,24.85,82.7,0,82.7,3,2015,7,20,6/19/2015,31
326,DCI Dallas,"Dallas, TX",Dallas,TX,7/20/2015,Blue Stars,81,77,15.8,80,80,16,NA,NA,NA,NA,NA,NA,NA,NA,31.8,78,75,15.3,76,74,15,82,79,16.1,23.2,80,77,15.7,80,78,15.8,NA,NA,NA,NA,84,80,16.4,23.95,78.95,0,78.95,4,2015,7,20,6/17/2015,33
327,DCI Dallas,"Dallas, TX",Dallas,TX,7/20/2015,Crossmen,79,78,15.7,78,79,15.7,NA,NA,NA,NA,NA,NA,NA,NA,31.4,81,78,15.9,81,78,15.9,78,76,15.4,23.6,76,75,15.1,79,76,15.5,NA,NA,NA,NA,80,77,15.7,23.15,78.15,0,78.15,5,2015,7,20,6/19/2015,31
328,DCI Dallas,"Dallas, TX",Dallas,TX,7/20/2015,Troopers,80,74,15.4,79,76,15.5,NA,NA,NA,NA,NA,NA,NA,NA,30.9,77,74,15.1,74,73,14.7,74,72,14.6,22.2,78,76,15.4,77,73,15,NA,NA,NA,NA,79,75,15.4,22.9,76,0,76,6,2015,7,20,6/19/2015,31
329,DCI Dallas,"Dallas, TX",Dallas,TX,7/20/2015,Colts,76,75,15.1,75,73,14.8,NA,NA,NA,NA,NA,NA,NA,NA,29.9,79,76,15.5,78,76,15.4,77,74,15.1,23,77,73,15,75,74,14.9,NA,NA,NA,NA,78,74,15.2,22.55,75.45,0,75.45,7,2015,7,20,6/20/2015,30
330,DCI Dallas,"Dallas, TX",Dallas,TX,7/20/2015,Mandarins,73,68,14.1,72,71,14.3,NA,NA,NA,NA,NA,NA,NA,NA,28.4,72,67,13.9,71,69,14,71,68,13.9,20.9,74,72,14.6,72,71,14.3,NA,NA,NA,NA,74,70,14.4,21.65,70.95,0,70.95,8,2015,7,20,6/19/2015,31
331,Drums Across Cajun Field,"Lafayette, LA",Lafayette,LA,7/20/2015,Carolina Crown,87,86,17.3,88,88,17.6,NA,NA,NA,NA,NA,NA,NA,NA,34.9,88,87,17.5,86,85,17.1,87,87,17.4,26,88,85,17.3,90,88,17.8,NA,NA,NA,NA,86,84,17,26.05,86.95,0,86.95,1,2015,7,20,6/17/2015,33
332,Drums Across Cajun Field,"Lafayette, LA",Lafayette,LA,7/20/2015,Bluecoats,88,84,17.2,89,86,17.5,NA,NA,NA,NA,NA,NA,NA,NA,34.7,87,86,17.3,88,86,17.4,86,85,17.1,25.9,87,82,16.9,89,87,17.6,NA,NA,NA,NA,85,88,17.3,25.9,86.5,0,86.5,2,2015,7,20,6/17/2015,33
333,Drums Across Cajun Field,"Lafayette, LA",Lafayette,LA,7/20/2015,Phantom Regiment,83,81,16.4,84,83,16.7,NA,NA,NA,NA,NA,NA,NA,NA,33.1,83,82,16.5,83,82,16.5,82,82,16.4,24.7,83,79,16.2,83,79,16.2,NA,NA,NA,NA,79,75,15.4,23.9,81.7,0,81.7,3,2015,7,20,6/19/2015,31
334,Drums Across Cajun Field,"Lafayette, LA",Lafayette,LA,7/20/2015,Madison Scouts,82,79,16.1,82,80,16.2,NA,NA,NA,NA,NA,NA,NA,NA,32.3,80,79,15.9,81,79,16,75,76,15.1,23.5,79,78,15.7,82,78,16,NA,NA,NA,NA,82,82,16.4,24.05,79.85,0,79.85,4,2015,7,20,6/17/2015,33
335,Drums Across Cajun Field,"Lafayette, LA",Lafayette,LA,7/20/2015,Boston Crusaders,81,77,15.8,80,78,15.8,NA,NA,NA,NA,NA,NA,NA,NA,31.6,82,81,16.3,78,77,15.5,80,78,15.8,23.8,77,73,15,80,76,15.6,NA,NA,NA,NA,75,72,14.7,22.65,78.05,0,78.05,5,2015,7,20,6/20/2015,30
336,Drums Across Cajun Field,"Lafayette, LA",Lafayette,LA,7/20/2015,Spirit of Atlanta,76,73,14.9,75,73,14.8,NA,NA,NA,NA,NA,NA,NA,NA,29.7,68,66,13.4,76,74,15,76,72,14.8,21.6,74,73,14.7,74,68,14.2,NA,NA,NA,NA,65,64,12.9,20.9,72.2,0,72.2,6,2015,7,20,6/20/2015,30
337,Drums Across Cajun Field,"Lafayette, LA",Lafayette,LA,7/20/2015,Pioneer,66,61,12.7,64,62,12.6,NA,NA,NA,NA,NA,NA,NA,NA,25.3,63,59,12.2,72,67,13.9,63,57,12,19.05,62,59,12.1,58,54,11.2,NA,NA,NA,NA,58,55,11.3,17.3,61.65,0,61.65,8,2015,7,20,6/23/2015,27
338,Drums of Summer,"Broken Arrow, OK",Broken Arrow,OK,7/21/2015,The Cadets,90,90,18,89,87,17.6,NA,NA,NA,NA,NA,NA,NA,NA,35.6,90,89,17.9,89,87,17.6,89,88,17.7,26.6,87,86,17.3,90,89,17.9,NA,NA,NA,NA,89,89,17.8,26.5,88.7,0,88.7,1,2015,7,21,6/17/2015,34
339,Drums of Summer,"Broken Arrow, OK",Broken Arrow,OK,7/21/2015,Blue Knights,86,85,17.1,84,82,16.6,NA,NA,NA,NA,NA,NA,NA,NA,33.7,85,81,16.6,83,80,16.3,82,82,16.4,24.65,83,82,16.5,85,82,16.7,NA,NA,NA,NA,84,83,16.7,24.95,83.3,0,83.3,2,2015,7,21,6/19/2015,32
340,Drums of Summer,"Broken Arrow, OK",Broken Arrow,OK,7/21/2015,Crossmen,80,79,15.9,80,76,15.6,NA,NA,NA,NA,NA,NA,NA,NA,31.5,82,79,16.1,82,79,16.1,80,79,15.9,24.05,79,77,15.6,80,77,15.7,NA,NA,NA,NA,81,79,16,23.65,79.2,0,79.2,3,2015,7,21,6/19/2015,32
341,Drums of Summer,"Broken Arrow, OK",Broken Arrow,OK,7/21/2015,Blue Stars,81,77,15.8,77,75,15.2,NA,NA,NA,NA,NA,NA,NA,NA,31,78,77,15.5,81,78,15.9,83,78,16.1,23.75,81,78,15.9,81,78,15.9,NA,NA,NA,NA,85,84,16.9,24.35,79.1,0,79.1,4,2015,7,21,6/17/2015,34
342,Drums of Summer,"Broken Arrow, OK",Broken Arrow,OK,7/21/2015,Colts,77,76,15.3,75,73,14.8,NA,NA,NA,NA,NA,NA,NA,NA,30.1,80,76,15.6,80,77,15.7,78,76,15.4,23.35,78,76,15.4,77,75,15.2,NA,NA,NA,NA,78,76,15.4,23,76.45,0,76.45,5,2015,7,21,6/20/2015,31
343,Drums of Summer,"Broken Arrow, OK",Broken Arrow,OK,7/21/2015,Oregon Crusaders,72,68,14,70,70,14,NA,NA,NA,NA,NA,NA,NA,NA,28,75,72,14.7,69,66,13.5,76,74,15,21.6,76,75,15.1,73,71,14.4,NA,NA,NA,NA,73,70,14.3,21.9,71.5,0,71.5,6,2015,7,21,7/2/2015,19
344,Drums of Summer,"Broken Arrow, OK",Broken Arrow,OK,7/21/2015,Mandarins,73,70,14.3,74,68,14.2,NA,NA,NA,NA,NA,NA,NA,NA,28.5,73,69,14.2,72,71,14.3,72,69,14.1,21.3,74,74,14.8,70,68,13.8,NA,NA,NA,NA,75,72,14.7,21.65,71.45,0,71.45,7,2015,7,21,6/19/2015,32
345,Drums of Summer,"Broken Arrow, OK",Broken Arrow,OK,7/21/2015,Pacific Crest,70,69,13.9,70,66,13.6,NA,NA,NA,NA,NA,NA,NA,NA,27.5,74,71,14.5,70,68,13.8,73,72,14.5,21.4,75,72,14.7,71,66,13.7,NA,NA,NA,NA,70,68,13.8,21.1,70,0,70,8,2015,7,21,6/19/2015,32
346,Drums of Summer,"Broken Arrow, OK",Broken Arrow,OK,7/21/2015,Jersey Surf,67,64,13.1,64,64,12.8,NA,NA,NA,NA,NA,NA,NA,NA,25.9,69,65,13.4,68,65,13.3,68,65,13.3,20,71,71,14.2,66,64,13,NA,NA,NA,NA,62,59,12.1,19.65,65.55,0,65.55,9,2015,7,21,7/2/2015,19
347,Mississippi Sound Spectacular,"Ocean Springs, MS",Ocean Springs,MS,7/21/2015,Carolina Crown,88,87,17.5,89,90,17.9,NA,NA,NA,NA,NA,NA,NA,NA,35.4,91,89,18,88,88,17.6,88,87,17.5,26.55,88,86,17.4,91,90,18.1,NA,NA,NA,NA,86,85,17.1,26.3,88.25,0,88.25,1,2015,7,21,6/17/2015,34
348,Mississippi Sound Spectacular,"Ocean Springs, MS",Ocean Springs,MS,7/21/2015,Bluecoats,87,85,17.2,90,87,17.7,NA,NA,NA,NA,NA,NA,NA,NA,34.9,89,88,17.7,89,89,17.8,87,85,17.2,26.35,87,85,17.2,90,89,17.9,NA,NA,NA,NA,87,86,17.3,26.2,87.45,0,87.45,2,2015,7,21,6/17/2015,34
349,Mississippi Sound Spectacular,"Ocean Springs, MS",Ocean Springs,MS,7/21/2015,The Cavaliers,84,81,16.5,82,78,16,NA,NA,NA,NA,NA,NA,NA,NA,32.5,86,84,17,83,82,16.5,82,80,16.2,24.85,85,83,16.8,82,80,16.2,NA,NA,NA,NA,85,83,16.8,24.9,82.25,0,82.25,3,2015,7,21,6/17/2015,34
350,Mississippi Sound Spectacular,"Ocean Springs, MS",Ocean Springs,MS,7/21/2015,Boston Crusaders,81,79,16,77,76,15.3,NA,NA,NA,NA,NA,NA,NA,NA,31.3,80,76,15.6,81,78,15.9,81,78,15.9,23.7,78,73,15.1,81,78,15.9,NA,NA,NA,NA,82,80,16.2,23.6,78.6,0,78.6,4,2015,7,21,6/20/2015,31
351,Mississippi Sound Spectacular,"Ocean Springs, MS",Ocean Springs,MS,7/21/2015,The Academy,79,76,15.5,78,73,15.1,NA,NA,NA,NA,NA,NA,NA,NA,30.6,77,72,14.9,77,76,15.3,77,75,15.2,22.7,75,72,14.7,78,76,15.4,NA,NA,NA,NA,76,75,15.1,22.6,75.9,0,75.9,5,2015,7,21,6/27/2015,24
352,Mississippi Sound Spectacular,"Ocean Springs, MS",Ocean Springs,MS,7/21/2015,Pioneer,63,61,12.4,63,60,12.3,NA,NA,NA,NA,NA,NA,NA,NA,24.7,66,60,12.6,67,63,13,66,61,12.7,19.15,65,61,12.6,63,61,12.4,NA,NA,NA,NA,60,58,11.8,18.4,62.25,0,62.25,7,2015,7,21,6/23/2015,28
353,DCI Southern Mississippi,"Hattiesburg, MS",Hattiesburg,MS,7/22/2015,Blue Devils,89,88,17.7,89,88,17.7,NA,NA,NA,NA,NA,NA,NA,NA,35.4,89,87,17.6,92,91,18.3,90,88,17.8,26.85,89,88,17.7,90,89,17.9,NA,NA,NA,NA,89,86,17.5,26.55,88.8,0,88.8,1,2015,7,22,6/19/2015,33
354,DCI Southern Mississippi,"Hattiesburg, MS",Hattiesburg,MS,7/22/2015,Bluecoats,88,86,17.4,90,89,17.9,NA,NA,NA,NA,NA,NA,NA,NA,35.3,87,85,17.2,90,89,17.9,88,86,17.4,26.25,90,86,17.6,88,86,17.4,NA,NA,NA,NA,88,88,17.6,26.3,87.85,0,87.85,2,2015,7,22,6/17/2015,35
355,DCI Southern Mississippi,"Hattiesburg, MS",Hattiesburg,MS,7/22/2015,The Cavaliers,84,83,16.7,84,81,16.5,NA,NA,NA,NA,NA,NA,NA,NA,33.2,85,82,16.7,86,85,17.1,84,83,16.7,25.25,86,84,17,85,83,16.8,NA,NA,NA,NA,85,83,16.8,25.3,83.75,0,83.75,3,2015,7,22,6/17/2015,35
356,DCI Southern Mississippi,"Hattiesburg, MS",Hattiesburg,MS,7/22/2015,Madison Scouts,82,82,16.4,82,82,16.4,NA,NA,NA,NA,NA,NA,NA,NA,32.8,82,80,16.2,83,82,16.5,79,81,16,24.35,81,80,16.1,83,81,16.4,NA,NA,NA,NA,83,82,16.5,24.5,81.65,0,81.65,4,2015,7,22,6/17/2015,35
357,DCI Southern Mississippi,"Hattiesburg, MS",Hattiesburg,MS,7/22/2015,Troopers,81,79,16,80,78,15.8,NA,NA,NA,NA,NA,NA,NA,NA,31.8,80,79,15.9,80,79,15.9,73,73,14.6,23.2,79,76,15.5,76,74,15,NA,NA,NA,NA,80,75,15.5,23,78,0,78,5,2015,7,22,6/19/2015,33
358,DCI Southern Mississippi,"Hattiesburg, MS",Hattiesburg,MS,7/22/2015,The Academy,79,77,15.6,77,76,15.3,NA,NA,NA,NA,NA,NA,NA,NA,30.9,78,77,15.5,75,73,14.8,75,75,15,22.65,77,74,15.1,77,75,15.2,NA,NA,NA,NA,76,73,14.9,22.6,76.15,0,76.15,6,2015,7,22,6/27/2015,25
359,DCI Southern Mississippi,"Hattiesburg, MS",Hattiesburg,MS,7/22/2015,Spirit of Atlanta,77,73,15,75,72,14.7,NA,NA,NA,NA,NA,NA,NA,NA,29.7,68,67,13.5,78,77,15.5,78,76,15.4,22.2,73,72,14.5,75,73,14.8,NA,NA,NA,NA,68,64,13.2,21.25,73.15,0,73.15,7,2015,7,22,6/20/2015,32
360,DCI Southern Mississippi,"Hattiesburg, MS",Hattiesburg,MS,7/22/2015,Pioneer,67,62,12.9,63,61,12.4,NA,NA,NA,NA,NA,NA,NA,NA,25.3,62,59,12.1,72,68,14,65,59,12.4,19.25,64,62,12.6,65,63,12.8,NA,NA,NA,NA,62,59,12.1,18.75,63.3,0,63.3,8,2015,7,22,6/23/2015,29
361,DCI Arkansas,"Little Rock, AR",Little Rock,AR,7/22/2015,Santa Clara Vanguard,89,87,17.6,91,89,18,NA,NA,NA,NA,NA,NA,NA,NA,35.6,90,88,17.8,87,84,17.1,88,87,17.5,26.2,87,85,17.2,89,87,17.6,NA,NA,NA,NA,91,90,18.1,26.45,88.25,0,88.25,1,2015,7,22,6/19/2015,33
362,DCI Arkansas,"Little Rock, AR",Little Rock,AR,7/22/2015,Blue Knights,84,82,16.6,88,87,17.5,NA,NA,NA,NA,NA,NA,NA,NA,34.1,86,84,17,83,80,16.3,82,81,16.3,24.8,84,82,16.6,86,84,17,NA,NA,NA,NA,87,84,17.1,25.35,84.25,0,84.25,2,2015,7,22,6/19/2015,33
363,DCI Arkansas,"Little Rock, AR",Little Rock,AR,7/22/2015,Blue Stars,82,75,15.7,81,78,15.9,NA,NA,NA,NA,NA,NA,NA,NA,31.6,81,79,16,77,76,15.3,84,83,16.7,24,83,80,16.3,83,80,16.3,NA,NA,NA,NA,86,83,16.9,24.75,80.35,0,80.35,3,2015,7,22,6/17/2015,35
364,DCI Arkansas,"Little Rock, AR",Little Rock,AR,7/22/2015,Crossmen,81,77,15.8,79,77,15.6,NA,NA,NA,NA,NA,NA,NA,NA,31.4,82,81,16.3,82,79,16.1,81,79,16,24.2,81,79,16,80,78,15.8,NA,NA,NA,NA,84,82,16.6,24.2,79.8,0,79.8,4,2015,7,22,6/19/2015,33
365,DCI Arkansas,"Little Rock, AR",Little Rock,AR,7/22/2015,Colts,78,74,15.2,77,75,15.2,NA,NA,NA,NA,NA,NA,NA,NA,30.4,79,77,15.6,81,78,15.9,79,75,15.4,23.45,80,77,15.7,78,76,15.4,NA,NA,NA,NA,81,79,16,23.55,77.4,0,77.4,5,2015,7,22,6/20/2015,32
366,DCI Arkansas,"Little Rock, AR",Little Rock,AR,7/22/2015,Oregon Crusaders,76,73,14.9,73,72,14.5,NA,NA,NA,NA,NA,NA,NA,NA,29.4,76,72,14.8,69,67,13.6,71,68,13.9,21.15,77,74,15.1,72,71,14.3,NA,NA,NA,NA,75,74,14.9,22.15,72.7,0,72.7,6,2015,7,22,7/2/2015,20
367,DCI Arkansas,"Little Rock, AR",Little Rock,AR,7/22/2015,Mandarins,74,71,14.5,74,73,14.7,NA,NA,NA,NA,NA,NA,NA,NA,29.2,73,70,14.3,71,69,14,73,69,14.2,21.25,75,73,14.8,71,68,13.9,NA,NA,NA,NA,76,73,14.9,21.8,72.25,0,72.25,7,2015,7,22,6/19/2015,33
368,DCI Arkansas,"Little Rock, AR",Little Rock,AR,7/22/2015,Pacific Crest,72,69,14.1,71,67,13.8,NA,NA,NA,NA,NA,NA,NA,NA,27.9,75,74,14.9,74,70,14.4,75,73,14.8,22.05,74,72,14.6,73,69,14.2,NA,NA,NA,NA,74,70,14.4,21.6,71.55,0,71.55,8,2015,7,22,6/19/2015,33
369,DCI Arkansas,"Little Rock, AR",Little Rock,AR,7/22/2015,Jersey Surf,70,66,13.6,64,65,12.9,NA,NA,NA,NA,NA,NA,NA,NA,26.5,70,65,13.5,70,68,13.8,68,65,13.3,20.3,71,69,14,67,63,13,NA,NA,NA,NA,66,64,13,20,66.8,0,66.8,9,2015,7,22,7/2/2015,20
370,DCI North Alabama,"Huntsville, AL",Huntsville,AL,7/23/2015,The Cadets,90,90,18,90,90,18,NA,NA,NA,NA,NA,NA,NA,NA,36,89,88,17.7,91,89,18,89,87,17.6,26.65,90,89,17.9,91,90,18.1,NA,NA,NA,NA,92,90,18.2,27.1,89.75,0,89.75,1,2015,7,23,6/17/2015,36
371,DCI North Alabama,"Huntsville, AL",Huntsville,AL,7/23/2015,Crossmen,83,82,16.5,82,80,16.2,NA,NA,NA,NA,NA,NA,NA,NA,32.7,85,83,16.8,81,82,16.3,82,80,16.2,24.65,84,81,16.5,81,80,16.1,NA,NA,NA,NA,85,83,16.8,24.7,82.05,0,82.05,2,2015,7,23,6/19/2015,34
372,DCI North Alabama,"Huntsville, AL",Huntsville,AL,7/23/2015,Troopers,82,80,16.2,81,79,16,NA,NA,NA,NA,NA,NA,NA,NA,32.2,82,77,15.9,83,81,16.4,78,76,15.4,23.85,81,80,16.1,80,78,15.8,NA,NA,NA,NA,81,80,16.1,24,80.05,0,80.05,3,2015,7,23,6/19/2015,34
373,DCI North Alabama,"Huntsville, AL",Huntsville,AL,7/23/2015,The Academy,80,79,15.9,77,75,15.2,NA,NA,NA,NA,NA,NA,NA,NA,31.1,83,79,16.2,80,80,16,80,79,15.9,24.05,79,78,15.7,79,77,15.6,NA,NA,NA,NA,79,78,15.7,23.5,78.65,0,78.65,4,2015,7,23,6/27/2015,26
374,DCI North Alabama,"Huntsville, AL",Huntsville,AL,7/23/2015,Oregon Crusaders,77,76,15.3,74,72,14.6,NA,NA,NA,NA,NA,NA,NA,NA,29.9,77,72,14.9,74,72,14.6,75,73,14.8,22.15,78,75,15.3,76,74,15,NA,NA,NA,NA,77,75,15.2,22.75,74.8,0,74.8,5,2015,7,23,7/2/2015,21
375,DCI North Alabama,"Huntsville, AL",Huntsville,AL,7/23/2015,Pacific Crest,75,74,14.9,76,74,15,NA,NA,NA,NA,NA,NA,NA,NA,29.9,80,78,15.8,73,70,14.3,74,71,14.5,22.3,76,76,15.2,74,72,14.6,NA,NA,NA,NA,76,73,14.9,22.35,74.55,0,74.55,6,2015,7,23,6/19/2015,34
376,DCI North Alabama,"Huntsville, AL",Huntsville,AL,7/23/2015,Jersey Surf,72,70,14.2,65,63,12.8,NA,NA,NA,NA,NA,NA,NA,NA,27,71,66,13.7,64,65,12.9,68,63,13.1,19.85,71,70,14.1,67,65,13.2,NA,NA,NA,NA,68,66,13.4,20.35,67.2,0,67.2,7,2015,7,23,7/2/2015,21
377,DCI North Alabama,"Huntsville, AL",Huntsville,AL,7/23/2015,Pioneer,68,65,13.3,62,60,12.2,NA,NA,NA,NA,NA,NA,NA,NA,25.5,63,58,12.1,66,62,12.8,67,62,12.9,18.9,63,60,12.3,66,63,12.9,NA,NA,NA,NA,64,61,12.5,18.85,63.25,0,63.25,9,2015,7,23,6/23/2015,30
378,The Masters of the Summer Music Games,"Murfreesboro, TN",Murfreesboro,TN,7/24/2015,Blue Devils,92,91,18.3,89,89,17.8,NA,NA,NA,NA,NA,NA,NA,NA,36.1,91,88,17.9,91,89,18,91,90,18.1,27,90,90,18,86,86,17.2,NA,NA,NA,NA,90,88,17.8,26.5,89.6,0,89.6,1,2015,7,24,6/19/2015,35
379,The Masters of the Summer Music Games,"Murfreesboro, TN",Murfreesboro,TN,7/24/2015,Carolina Crown,88,90,17.8,90,91,18.1,NA,NA,NA,NA,NA,NA,NA,NA,35.9,90,87,17.7,88,87,17.5,90,89,17.9,26.55,90,89,17.9,87,88,17.5,NA,NA,NA,NA,91,89,18,26.7,89.15,0,89.15,2,2015,7,24,6/17/2015,37
380,The Masters of the Summer Music Games,"Murfreesboro, TN",Murfreesboro,TN,7/24/2015,The Cadets,90,89,17.9,91,88,17.9,NA,NA,NA,NA,NA,NA,NA,NA,35.8,89,89,17.8,90,86,17.6,87,87,17.4,26.4,91,90,18.1,89,87,17.6,NA,NA,NA,NA,88,86,17.4,26.55,88.75,0,88.75,3,2015,7,24,6/17/2015,37
381,The Masters of the Summer Music Games,"Murfreesboro, TN",Murfreesboro,TN,7/24/2015,Bluecoats,91,86,17.7,90,90,18,NA,NA,NA,NA,NA,NA,NA,NA,35.7,88,86,17.4,89,88,17.7,89,86,17.5,26.3,89,88,17.7,85,85,17,NA,NA,NA,NA,89,87,17.6,26.15,88.15,0,88.15,4,2015,7,24,6/17/2015,37
382,The Masters of the Summer Music Games,"Murfreesboro, TN",Murfreesboro,TN,7/24/2015,Santa Clara Vanguard,89,87,17.6,87,86,17.3,NA,NA,NA,NA,NA,NA,NA,NA,34.9,87,85,17.2,86,85,17.1,88,88,17.6,25.95,88,87,17.5,84,84,16.8,NA,NA,NA,NA,92,90,18.2,26.25,87.1,0,87.1,5,2015,7,24,6/19/2015,35
383,The Masters of the Summer Music Games,"Murfreesboro, TN",Murfreesboro,TN,7/24/2015,Blue Knights,87,85,17.2,88,84,17.2,NA,NA,NA,NA,NA,NA,NA,NA,34.4,85,82,16.7,84,82,16.6,85,84,16.9,25.1,87,86,17.3,83,81,16.4,NA,NA,NA,NA,85,83,16.8,25.25,84.75,0,84.75,6,2015,7,24,6/19/2015,35
384,The Masters of the Summer Music Games,"Murfreesboro, TN",Murfreesboro,TN,7/24/2015,The Cavaliers,84,84,16.8,86,85,17.1,NA,NA,NA,NA,NA,NA,NA,NA,33.9,84,84,16.8,83,80,16.3,84,81,16.5,24.8,86,85,17.1,82,80,16.2,NA,NA,NA,NA,87,85,17.2,25.25,83.95,0,83.95,7,2015,7,24,6/17/2015,37
385,The Masters of the Summer Music Games,"Murfreesboro, TN",Murfreesboro,TN,7/24/2015,Phantom Regiment,85,82,16.7,85,83,16.8,NA,NA,NA,NA,NA,NA,NA,NA,33.5,82,81,16.3,81,81,16.2,83,83,16.6,24.55,85,84,16.9,81,82,16.3,NA,NA,NA,NA,86,84,17,25.1,83.15,0,83.15,8,2015,7,24,6/19/2015,35
386,Alabama Sounds of Summer,"Opelika, AL",Opelika,AL,7/24/2015,Madison Scouts,84,83,16.7,82,81,16.3,NA,NA,NA,NA,NA,NA,NA,NA,33,79,81,16,83,82,16.5,83,82,16.5,24.5,85,83,16.8,81,80,16.1,NA,NA,NA,NA,84,83,16.7,24.8,82.3,0,82.3,1,2015,7,24,6/17/2015,37
387,Alabama Sounds of Summer,"Opelika, AL",Opelika,AL,7/24/2015,Blue Stars,80,79,15.9,81,79,16,NA,NA,NA,NA,NA,NA,NA,NA,31.9,80,76,15.6,79,81,16,87,84,17.1,24.35,82,80,16.2,83,81,16.4,NA,NA,NA,NA,87,85,17.2,24.9,81.15,0,81.15,2,2015,7,24,6/17/2015,37
388,Alabama Sounds of Summer,"Opelika, AL",Opelika,AL,7/24/2015,Boston Crusaders,82,80,16.2,79,75,15.4,NA,NA,NA,NA,NA,NA,NA,NA,31.6,83,80,16.3,82,80,16.2,86,83,16.9,24.7,81,79,16,82,78,16,NA,NA,NA,NA,85,84,16.9,24.45,80.75,0,80.75,3,2015,7,24,6/20/2015,34
389,Alabama Sounds of Summer,"Opelika, AL",Opelika,AL,7/24/2015,Colts,78,78,15.6,78,77,15.5,NA,NA,NA,NA,NA,NA,NA,NA,31.1,78,75,15.3,80,77,15.7,80,77,15.7,23.35,77,75,15.2,80,76,15.6,NA,NA,NA,NA,83,80,16.3,23.55,78,0,78,4,2015,7,24,6/20/2015,34
390,Alabama Sounds of Summer,"Opelika, AL",Opelika,AL,7/24/2015,Spirit of Atlanta,77,76,15.3,77,73,15,NA,NA,NA,NA,NA,NA,NA,NA,30.3,76,73,14.9,78,76,15.4,77,71,14.8,22.55,76,74,15,76,73,14.9,NA,NA,NA,NA,74,73,14.7,22.3,75.15,0,75.15,5,2015,7,24,6/20/2015,34
391,Alabama Sounds of Summer,"Opelika, AL",Opelika,AL,7/24/2015,Mandarins,76,74,15,76,72,14.8,NA,NA,NA,NA,NA,NA,NA,NA,29.8,72,74,14.6,74,72,14.6,75,74,14.9,22.05,78,76,15.4,77,74,15.1,NA,NA,NA,NA,80,75,15.5,23,74.85,0,74.85,6,2015,7,24,6/19/2015,35
392,DCI Southeastern Championship,"Atlanta, GA",Atlanta,GA,7/25/2015,Carolina Crown,93,92,18.5,92,92,18.4,18.45,92,93,18.5,93,92,18.5,18.5,36.95,91,92,18.3,93,90,18.3,91,90,18.1,27.35,92,92,18.4,90,92,18.2,91,88,17.9,89,88,17.7,17.8,27.2,91.5,0,91.5,1,2015,7,25,6/17/2015,38
393,DCI Southeastern Championship,"Atlanta, GA",Atlanta,GA,7/25/2015,Blue Devils,94,93,18.7,94,91,18.5,18.6,91,91,18.2,92,91,18.3,18.25,36.85,93,91,18.4,94,92,18.6,90,89,17.9,27.45,91,91,18.2,89,88,17.7,93,95,18.8,91,90,18.1,18.45,27.175,91.475,0,91.475,2,2015,7,25,6/19/2015,36
394,DCI Southeastern Championship,"Atlanta, GA",Atlanta,GA,7/25/2015,The Cadets,92,90,18.2,91,91,18.2,18.2,92,92,18.4,90,88,17.8,18.1,36.3,92,87,17.9,92,93,18.5,88,88,17.6,27,93,90,18.3,92,91,18.3,92,93,18.5,93,90,18.3,18.4,27.5,90.8,0,90.8,3,2015,7,25,6/17/2015,38
395,DCI Southeastern Championship,"Atlanta, GA",Atlanta,GA,7/25/2015,Bluecoats,91,88,17.9,90,88,17.8,17.85,90,90,18,91,89,18,18,35.85,90,90,18,95,93,18.8,87,87,17.4,27.1,90,87,17.7,91,90,18.1,90,94,18.4,90,89,17.9,18.15,26.975,89.925,0.4,89.525,4,2015,7,25,6/17/2015,38
